2024-07-17 12:44:08
######## 7/17/2024, 12:44:21 PM
tid=d55c22b17a56c4f801b4c8d2ffcc25af

 【请求的 ip 】：13.91.69.162
 【 用  户 】 加了  617         个单词上限2024-07-17 12:45:58
######## 7/17/2024, 12:46:12 PM
tid=d55c22b17a56c4f801b4c8d2ffcc25af

 【请求的 ip 】：52.238.24.178
 【 用  户 】 加了  617         个单词上限2024-07-17 14:42:39
######## 7/17/2024, 2:42:53 PM
tid=d55c22b17a56c4f801b4c8d2ffcc25af

 【请求的 ip 】：20.97.191.96
 【 用  户 】 加了  617         个单词上限2024-07-17 15:39:51
######## 7/17/2024, 3:40:04 PM
tid=d55c22b17a56c4f801b4c8d2ffcc25af

 【请求的 ip 】：20.172.5.221
 【 用  户 】 加了  617         个单词上限2024-07-17 17:40:12
######## 7/17/2024, 5:40:26 PM
tid=d55c22b17a56c4f801b4c8d2ffcc25af

 【请求的 ip 】：172.183.74.6
 【 用  户 】 加了  617         个单词上限2024-07-17 18:40:44
######## 7/17/2024, 6:40:58 PM
tid=d55c22b17a56c4f801b4c8d2ffcc25af

 【请求的 ip 】：20.161.78.13
 【 用  户 】 加了  617         个单词上限2024-07-18 12:41:43
######## 7/18/2024, 12:41:57 PM
tid=d55c22b17a56c4f801b4c8d2ffcc25af

 【请求的 ip 】：20.55.46.196
 【 用  户 】 加了  617         个单词上限2024-07-18 14:42:45
######## 7/18/2024, 2:42:59 PM
tid=d55c22b17a56c4f801b4c8d2ffcc25af

 【请求的 ip 】：52.234.36.37
 【 用  户 】 加了  620         个单词上限2024-07-18 15:39:36
######## 7/18/2024, 3:39:50 PM
tid=d55c22b17a56c4f801b4c8d2ffcc25af

 【请求的 ip 】：172.183.107.128
 【 用  户 】 加了  620         个单词上限2024-07-18 17:39:34
######## 7/18/2024, 5:39:48 PM
tid=d55c22b17a56c4f801b4c8d2ffcc25af

 【请求的 ip 】：52.234.33.242
 【 用  户 】 加了  620         个单词上限2024-07-18 18:40:41
######## 7/18/2024, 6:40:55 PM
tid=d55c22b17a56c4f801b4c8d2ffcc25af

 【请求的 ip 】：172.200.207.226
 【 用  户 】 加了  620         个单词上限2024-07-19 12:41:37
######## 7/19/2024, 12:41:52 PM
tid=d55c22b17a56c4f801b4c8d2ffcc25af

 【请求的 ip 】：20.81.159.194
 【 用  户 】 加了  623         个单词上限2024-07-19 14:42:27
######## 7/19/2024, 2:42:40 PM
tid=be9ac66de488a37972f939c4666d7125

 【请求的 ip 】：13.83.1.192
 【 用  户 】 加了  623         个单词上限2024-07-19 15:39:16
######## 7/19/2024, 3:39:29 PM
tid=be9ac66de488a37972f939c4666d7125

 【请求的 ip 】：52.234.38.142
 【 用  户 】 加了  623         个单词上限2024-07-19 17:41:01
######## 7/19/2024, 5:41:16 PM
tid=be9ac66de488a37972f939c4666d7125

 【请求的 ip 】：20.55.14.228
 【 用  户 】 加了  623         个单词上限2024-07-19 18:39:51
######## 7/19/2024, 6:40:05 PM
tid=be9ac66de488a37972f939c4666d7125

 【请求的 ip 】：20.55.15.36
 【 用  户 】 加了  623         个单词上限2024-07-20 12:41:35
######## 7/20/2024, 12:41:49 PM
tid=be9ac66de488a37972f939c4666d7125

 【请求的 ip 】：172.183.91.8
 【 用  户 】 加了  626         个单词上限2024-07-20 14:41:41
######## 7/20/2024, 2:41:55 PM
tid=be9ac66de488a37972f939c4666d7125

 【请求的 ip 】：172.183.79.2
 【 用  户 】 加了  626         个单词上限2024-07-20 15:39:38
######## 7/20/2024, 3:39:53 PM
tid=be9ac66de488a37972f939c4666d7125

 【请求的 ip 】：20.109.39.177
 【 用  户 】 加了  626         个单词上限2024-07-20 17:40:29
######## 7/20/2024, 5:40:43 PM
tid=be9ac66de488a37972f939c4666d7125

 【请求的 ip 】：4.227.115.112
 【 用  户 】 加了  626         个单词上限2024-07-20 18:41:29
######## 7/20/2024, 6:41:42 PM
tid=be9ac66de488a37972f939c4666d7125

 【请求的 ip 】：13.83.1.208
 【 用  户 】 加了  626         个单词上限2024-07-21 12:39:55
######## 7/21/2024, 12:40:09 PM
tid=be9ac66de488a37972f939c4666d7125

 【请求的 ip 】：172.183.91.2
 【 用  户 】 加了  629         个单词上限2024-07-21 14:42:17
######## 7/21/2024, 2:42:32 PM
tid=be9ac66de488a37972f939c4666d7125

 【请求的 ip 】：20.161.76.227
 【 用  户 】 加了  629         个单词上限2024-07-21 15:39:41
######## 7/21/2024, 3:39:54 PM
tid=be9ac66de488a37972f939c4666d7125

 【请求的 ip 】：172.183.131.79
 【 用  户 】 加了  629         个单词上限2024-07-21 17:39:32
######## 7/21/2024, 5:39:46 PM
tid=97e82118e4c1dacc0f923bc17d8a96e6

 【请求的 ip 】：20.172.6.169
 【 用  户 】 加了  629         个单词上限2024-07-21 18:39:19
######## 7/21/2024, 6:39:33 PM
tid=97e82118e4c1dacc0f923bc17d8a96e6

 【请求的 ip 】：172.183.53.32
 【 用  户 】 加了  629         个单词上限2024-07-22 12:41:16
######## 7/22/2024, 12:41:31 PM
tid=97e82118e4c1dacc0f923bc17d8a96e6

 【请求的 ip 】：20.109.38.149
 【 用  户 】 加了  631         个单词上限2024-07-22 14:43:07
######## 7/22/2024, 2:43:21 PM
tid=97e82118e4c1dacc0f923bc17d8a96e6

 【请求的 ip 】：52.190.141.146
 【 用  户 】 加了  631         个单词上限2024-07-22 15:40:23
######## 7/22/2024, 3:40:37 PM
tid=97e82118e4c1dacc0f923bc17d8a96e6

 【请求的 ip 】：172.183.98.96
 【 用  户 】 加了  631         个单词上限2024-07-22 17:40:25
######## 7/22/2024, 5:40:39 PM
tid=97e82118e4c1dacc0f923bc17d8a96e6

 【请求的 ip 】：172.190.111.148
 【 用  户 】 加了  631         个单词上限2024-07-22 18:40:04
######## 7/22/2024, 6:40:19 PM
tid=97e82118e4c1dacc0f923bc17d8a96e6

 【请求的 ip 】：20.102.46.179
 【 用  户 】 加了  631         个单词上限2024-07-23 12:40:18
######## 7/23/2024, 12:40:35 PM
tid=97e82118e4c1dacc0f923bc17d8a96e6

 【请求的 ip 】：13.83.123.178
 【 用  户 】 加了  631         个单词上限2024-07-23 14:42:36
######## 7/23/2024, 2:42:49 PM
tid=97e82118e4c1dacc0f923bc17d8a96e6

 【请求的 ip 】：40.76.117.200
 【 用  户 】 加了  631         个单词上限2024-07-23 15:39:17
######## 7/23/2024, 3:39:31 PM
tid=97e82118e4c1dacc0f923bc17d8a96e6

 【请求的 ip 】：20.55.213.87
 【 用  户 】 加了  634         个单词上限2024-07-23 17:39:16
######## 7/23/2024, 5:39:31 PM
tid=97e82118e4c1dacc0f923bc17d8a96e6

 【请求的 ip 】：20.172.0.37
 【 用  户 】 加了  634         个单词上限2024-07-23 18:40:06
######## 7/23/2024, 6:40:21 PM
tid=97e82118e4c1dacc0f923bc17d8a96e6

 【请求的 ip 】：20.55.47.50
 【 用  户 】 加了  634         个单词上限2024-07-24 12:40:07
######## 7/24/2024, 12:40:21 PM
tid=a03a309fb3f510fbbc55f31d1206f887

 【请求的 ip 】：52.157.14.88
 【 用  户 】 加了  634         个单词上限2024-07-24 14:42:57
######## 7/24/2024, 2:43:11 PM
tid=a03a309fb3f510fbbc55f31d1206f887

 【请求的 ip 】：20.81.46.155
 【 用  户 】 加了  634         个单词上限2024-07-24 15:39:24
######## 7/24/2024, 3:39:38 PM
tid=a03a309fb3f510fbbc55f31d1206f887

 【请求的 ip 】：20.55.222.97
 【 用  户 】 加了  634         个单词上限2024-07-24 17:39:48
######## 7/24/2024, 5:40:02 PM
tid=a03a309fb3f510fbbc55f31d1206f887

 【请求的 ip 】：20.172.17.131
 【 用  户 】 加了  634         个单词上限2024-07-24 18:40:37
######## 7/24/2024, 6:40:52 PM
tid=a03a309fb3f510fbbc55f31d1206f887

 【请求的 ip 】：74.249.14.213
 【 用  户 】 加了  634         个单词上限2024-07-25 12:42:18
######## 7/25/2024, 12:42:32 PM
tid=a03a309fb3f510fbbc55f31d1206f887

 【请求的 ip 】：20.55.14.229
 【 用  户 】 加了  634         个单词上限2024-07-25 14:42:55
######## 7/25/2024, 2:43:09 PM
tid=a03a309fb3f510fbbc55f31d1206f887

 【请求的 ip 】：172.183.138.55
 【 用  户 】 加了  634         个单词上限2024-07-25 15:39:24
######## 7/25/2024, 3:39:39 PM
tid=a03a309fb3f510fbbc55f31d1206f887

 【请求的 ip 】：20.172.29.182
 【 用  户 】 加了  634         个单词上限2024-07-25 17:39:22
######## 7/25/2024, 5:39:37 PM
tid=a03a309fb3f510fbbc55f31d1206f887

 【请求的 ip 】：52.234.38.241
 【 用  户 】 加了  637         个单词上限2024-07-25 18:40:32
######## 7/25/2024, 6:40:47 PM
tid=a03a309fb3f510fbbc55f31d1206f887

 【请求的 ip 】：172.200.199.173
 【 用  户 】 加了  637         个单词上限2024-07-26 12:42:31
######## 7/26/2024, 12:42:45 PM
tid=a03a309fb3f510fbbc55f31d1206f887

 【请求的 ip 】：20.161.77.207
 【 用  户 】 加了  637         个单词上限2024-07-26 14:43:09
######## 7/26/2024, 2:43:23 PM
tid=d80060adaed8bdfe337fd739313b1a84

 【请求的 ip 】：172.183.108.37
 【 用  户 】 加了  639         个单词上限2024-07-26 15:39:28
######## 7/26/2024, 3:39:41 PM
tid=d80060adaed8bdfe337fd739313b1a84

 【请求的 ip 】：52.225.76.22
 【 用  户 】 加了  639         个单词上限2024-07-26 17:39:28
######## 7/26/2024, 5:39:42 PM
tid=d80060adaed8bdfe337fd739313b1a84

 【请求的 ip 】：52.179.163.79
 【 用  户 】 加了  639         个单词上限2024-07-26 18:40:30
######## 7/26/2024, 6:40:44 PM
tid=d80060adaed8bdfe337fd739313b1a84

 【请求的 ip 】：172.200.199.255
 【 用  户 】 加了  639         个单词上限2024-07-27 12:40:30
######## 7/27/2024, 12:40:44 PM
tid=2492a79efae279a29ec8a1a8dcb4c444

 【请求的 ip 】：172.200.199.170
 【 用  户 】 加了  642         个单词上限2024-07-27 14:42:10
######## 7/27/2024, 2:42:25 PM
tid=2492a79efae279a29ec8a1a8dcb4c444

 【请求的 ip 】：20.97.191.189
 【 用  户 】 加了  642         个单词上限2024-07-27 15:39:12
######## 7/27/2024, 3:39:26 PM
tid=2492a79efae279a29ec8a1a8dcb4c444

 【请求的 ip 】：20.97.191.96
 【 用  户 】 加了  642         个单词上限2024-07-27 17:39:26
######## 7/27/2024, 5:39:40 PM
tid=2492a79efae279a29ec8a1a8dcb4c444

 【请求的 ip 】：20.55.214.160
 【 用  户 】 加了  642         个单词上限2024-07-27 18:39:11
######## 7/27/2024, 6:39:25 PM
tid=2492a79efae279a29ec8a1a8dcb4c444

 【请求的 ip 】：20.55.47.60
 【 用  户 】 加了  642         个单词上限2024-07-28 12:39:50
######## 7/28/2024, 12:40:04 PM
tid=2492a79efae279a29ec8a1a8dcb4c444

 【请求的 ip 】：52.234.26.83
 【 用  户 】 加了  645         个单词上限2024-07-28 14:43:01
######## 7/28/2024, 2:43:14 PM
tid=2492a79efae279a29ec8a1a8dcb4c444

 【请求的 ip 】：172.183.131.131
 【 用  户 】 加了  645         个单词上限2024-07-28 15:39:12
######## 7/28/2024, 3:39:26 PM
tid=2492a79efae279a29ec8a1a8dcb4c444

 【请求的 ip 】：20.55.214.241
 【 用  户 】 加了  645         个单词上限2024-07-28 17:39:24
######## 7/28/2024, 5:39:37 PM
tid=2492a79efae279a29ec8a1a8dcb4c444

 【请求的 ip 】：52.234.33.249
 【 用  户 】 加了  645         个单词上限2024-07-28 18:39:29
######## 7/28/2024, 6:39:43 PM
tid=2492a79efae279a29ec8a1a8dcb4c444

 【请求的 ip 】：20.171.78.151
 【 用  户 】 加了  645         个单词上限2024-07-29 12:40:53
######## 7/29/2024, 12:41:07 PM
tid=2492a79efae279a29ec8a1a8dcb4c444

 【请求的 ip 】：74.249.14.176
 【 用  户 】 加了  645         个单词上限2024-07-29 14:43:04
######## 7/29/2024, 2:43:18 PM
tid=9723a90f37ed1968c8311ada1117b868

 【请求的 ip 】：20.172.28.141
 【 用  户 】 加了  648         个单词上限2024-07-29 15:39:29
######## 7/29/2024, 3:39:43 PM
tid=9723a90f37ed1968c8311ada1117b868

 【请求的 ip 】：20.161.78.40
 【 用  户 】 加了  648         个单词上限2024-07-29 17:39:14
######## 7/29/2024, 5:39:28 PM
tid=9723a90f37ed1968c8311ada1117b868

 【请求的 ip 】：40.71.163.79
 【 用  户 】 加了  648         个单词上限2024-07-29 18:41:17
######## 7/29/2024, 6:41:31 PM
tid=9723a90f37ed1968c8311ada1117b868

 【请求的 ip 】：20.49.55.103
 【 用  户 】 加了  648         个单词上限2024-07-30 12:41:02
######## 7/30/2024, 12:41:16 PM
tid=9440547a7f40bbc5cf96657f908a4ed7

 【请求的 ip 】：172.183.130.204
 【 用  户 】 加了  651         个单词上限2024-07-30 14:43:02
######## 7/30/2024, 2:43:16 PM
tid=9440547a7f40bbc5cf96657f908a4ed7

 【请求的 ip 】：172.183.122.149
 【 用  户 】 加了  651         个单词上限2024-07-30 15:39:13
######## 7/30/2024, 3:39:27 PM
tid=9440547a7f40bbc5cf96657f908a4ed7

 【请求的 ip 】：20.161.78.59
 【 用  户 】 加了  651         个单词上限2024-07-30 17:39:32
######## 7/30/2024, 5:39:46 PM
tid=9440547a7f40bbc5cf96657f908a4ed7

 【请求的 ip 】：172.183.98.201
 【 用  户 】 加了  651         个单词上限2024-07-30 18:41:01
######## 7/30/2024, 6:41:15 PM
tid=9440547a7f40bbc5cf96657f908a4ed7

 【请求的 ip 】：172.183.131.40
 【 用  户 】 加了  651         个单词上限2024-07-31 12:39:37
######## 7/31/2024, 12:39:51 PM
tid=9440547a7f40bbc5cf96657f908a4ed7

 【请求的 ip 】：20.55.15.80
 【 用  户 】 加了  651         个单词上限2024-07-31 14:39:36
######## 7/31/2024, 2:39:50 PM
tid=9440547a7f40bbc5cf96657f908a4ed7

 【请求的 ip 】：52.234.38.66
 【 用  户 】 加了  651         个单词上限2024-07-31 15:39:30
######## 7/31/2024, 3:39:44 PM
tid=9440547a7f40bbc5cf96657f908a4ed7

 【请求的 ip 】：74.249.14.161
 【 用  户 】 加了  651         个单词上限2024-07-31 17:39:12
######## 7/31/2024, 5:39:28 PM
tid=9440547a7f40bbc5cf96657f908a4ed7

 【请求的 ip 】：172.183.161.207
 【 用  户 】 加了  651         个单词上限2024-07-31 18:40:04
######## 7/31/2024, 6:40:17 PM
tid=d4d5dbc635c32b6fec2b438e3fbbff1d

 【请求的 ip 】：13.91.68.161
 【 用  户 】 加了  654         个单词上限2024-08-01 12:40:51
######## 8/1/2024, 12:41:05 PM
tid=d4d5dbc635c32b6fec2b438e3fbbff1d

 【请求的 ip 】：20.55.15.37
 【 用  户 】 加了  654         个单词上限2024-08-01 14:43:23
######## 8/1/2024, 2:43:37 PM
tid=d4d5dbc635c32b6fec2b438e3fbbff1d

 【请求的 ip 】：172.183.112.122
 【 用  户 】 加了  654         个单词上限2024-08-01 15:39:34
######## 8/1/2024, 3:39:49 PM
tid=d4d5dbc635c32b6fec2b438e3fbbff1d

 【请求的 ip 】：20.75.95.208
 【 用  户 】 加了  656         个单词上限2024-08-01 17:39:21
######## 8/1/2024, 5:39:35 PM
tid=d4d5dbc635c32b6fec2b438e3fbbff1d

 【请求的 ip 】：4.227.115.6
 【 用  户 】 加了  656         个单词上限2024-08-01 18:41:22
######## 8/1/2024, 6:41:36 PM
tid=d4d5dbc635c32b6fec2b438e3fbbff1d

 【请求的 ip 】：20.172.0.46
 【 用  户 】 加了  656         个单词上限2024-08-02 12:42:17
######## 8/2/2024, 12:42:31 PM
tid=ec5b7f9189dd1b3e05ac3d104843ec06

 【请求的 ip 】：20.51.198.166
 【 用  户 】 加了  659         个单词上限2024-08-02 14:44:48
######## 8/2/2024, 2:45:03 PM
tid=ec5b7f9189dd1b3e05ac3d104843ec06

 【请求的 ip 】：20.55.222.97
 【 用  户 】 加了  659         个单词上限2024-08-02 15:39:34
######## 8/2/2024, 3:39:50 PM
tid=ec5b7f9189dd1b3e05ac3d104843ec06

 【请求的 ip 】：40.67.141.246
 【 用  户 】 加了  659         个单词上限2024-08-02 17:39:25
######## 8/2/2024, 5:39:39 PM
tid=ec5b7f9189dd1b3e05ac3d104843ec06

 【请求的 ip 】：172.183.91.42
 【 用  户 】 加了  659         个单词上限2024-08-02 18:40:23
######## 8/2/2024, 6:40:37 PM
tid=ec5b7f9189dd1b3e05ac3d104843ec06

 【请求的 ip 】：20.172.46.72
 【 用  户 】 加了  659         个单词上限2024-08-03 12:40:30
######## 8/3/2024, 12:40:45 PM
tid=ec5b7f9189dd1b3e05ac3d104843ec06

 【请求的 ip 】：172.200.199.177
 【 用  户 】 加了  662         个单词上限2024-08-03 14:42:34
######## 8/3/2024, 2:42:50 PM
tid=ec5b7f9189dd1b3e05ac3d104843ec06

 【请求的 ip 】：20.75.95.194
 【 用  户 】 加了  662         个单词上限2024-08-03 15:39:30
######## 8/3/2024, 3:39:43 PM
tid=ec5b7f9189dd1b3e05ac3d104843ec06

 【请求的 ip 】：52.157.4.81
 【 用  户 】 加了  662         个单词上限2024-08-03 17:39:50
######## 8/3/2024, 5:40:04 PM
tid=ec5b7f9189dd1b3e05ac3d104843ec06

 【请求的 ip 】：172.183.82.223
 【 用  户 】 加了  662         个单词上限2024-08-03 18:39:22
######## 8/3/2024, 6:39:37 PM
tid=ec5b7f9189dd1b3e05ac3d104843ec06

 【请求的 ip 】：172.183.107.18
 【 用  户 】 加了  662         个单词上限2024-08-04 12:42:24
######## 8/4/2024, 12:42:39 PM
tid=ec5b7f9189dd1b3e05ac3d104843ec06

 【请求的 ip 】：20.171.122.187
 【 用  户 】 加了  662         个单词上限2024-08-04 14:41:45
######## 8/4/2024, 2:41:59 PM
tid=ec5b7f9189dd1b3e05ac3d104843ec06

 【请求的 ip 】：52.234.38.240
 【 用  户 】 加了  662         个单词上限2024-08-04 15:39:15
######## 8/4/2024, 3:39:29 PM
tid=78f28a5ba7e5ae4aaa66b09df935e09b

 【请求的 ip 】：40.67.141.245
 【 用  户 】 加了  665         个单词上限2024-08-04 17:39:34
######## 8/4/2024, 5:39:48 PM
tid=78f28a5ba7e5ae4aaa66b09df935e09b

 【请求的 ip 】：20.51.159.34
 【 用  户 】 加了  665         个单词上限2024-08-04 18:39:12
######## 8/4/2024, 6:39:26 PM
tid=78f28a5ba7e5ae4aaa66b09df935e09b

 【请求的 ip 】：172.183.52.206
 【 用  户 】 加了  665         个单词上限2024-08-05 12:41:08
######## 8/5/2024, 12:41:22 PM
tid=78f28a5ba7e5ae4aaa66b09df935e09b

 【请求的 ip 】：172.183.82.219
 【 用  户 】 加了  665         个单词上限2024-08-05 14:43:32
######## 8/5/2024, 2:43:46 PM
tid=78f28a5ba7e5ae4aaa66b09df935e09b

 【请求的 ip 】：172.190.111.146
 【 用  户 】 加了  665         个单词上限2024-08-05 15:39:19
######## 8/5/2024, 3:39:32 PM
tid=ece97e0add7f3aa8dd45d24736814e70

 【请求的 ip 】：13.91.69.162
 【 用  户 】 加了  668         个单词上限2024-08-05 17:39:15
######## 8/5/2024, 5:39:29 PM
tid=ece97e0add7f3aa8dd45d24736814e70

 【请求的 ip 】：20.172.6.175
 【 用  户 】 加了  668         个单词上限2024-08-05 18:40:45
######## 8/5/2024, 6:41:00 PM
tid=ece97e0add7f3aa8dd45d24736814e70

 【请求的 ip 】：20.102.46.247
 【 用  户 】 加了  668         个单词上限2024-08-06 12:42:22
######## 8/6/2024, 12:42:37 PM
tid=ece97e0add7f3aa8dd45d24736814e70

 【请求的 ip 】：172.190.111.156
 【 用  户 】 加了  668         个单词上限2024-08-06 14:43:58
######## 8/6/2024, 2:44:13 PM
tid=4bd424318e29ec390622f6641dc738fa

 【请求的 ip 】：20.97.191.53
 【 用  户 】 加了  671         个单词上限2024-08-06 15:39:29
######## 8/6/2024, 3:39:43 PM
tid=4bd424318e29ec390622f6641dc738fa

 【请求的 ip 】：20.55.46.193
 【 用  户 】 加了  671         个单词上限2024-08-06 17:39:31
######## 8/6/2024, 5:39:44 PM
tid=4bd424318e29ec390622f6641dc738fa

 【请求的 ip 】：52.238.27.210
 【 用  户 】 加了  671         个单词上限2024-08-06 18:41:36
######## 8/6/2024, 6:41:50 PM
tid=4bd424318e29ec390622f6641dc738fa

 【请求的 ip 】：74.249.5.98
 【 用  户 】 加了  671         个单词上限2024-08-07 12:41:55
######## 8/7/2024, 12:42:09 PM
tid=14850b1e3d1dd5ab8aeba8a6aa1cc8c1

 【请求的 ip 】：52.232.165.92
 【 用  户 】 加了  674         个单词上限2024-08-07 14:44:58
######## 8/7/2024, 2:45:12 PM
tid=14850b1e3d1dd5ab8aeba8a6aa1cc8c1

 【请求的 ip 】：20.55.126.36
 【 用  户 】 加了  674         个单词上限2024-08-07 15:39:55
######## 8/7/2024, 3:40:09 PM
tid=14850b1e3d1dd5ab8aeba8a6aa1cc8c1

 【请求的 ip 】：52.234.40.27
 【 用  户 】 加了  674         个单词上限2024-08-07 17:39:25
######## 8/7/2024, 5:39:39 PM
tid=14850b1e3d1dd5ab8aeba8a6aa1cc8c1

 【请求的 ip 】：172.183.107.18
 【 用  户 】 加了  674         个单词上限2024-08-07 18:40:41
######## 8/7/2024, 6:40:55 PM
tid=14850b1e3d1dd5ab8aeba8a6aa1cc8c1

 【请求的 ip 】：20.55.14.173
 【 用  户 】 加了  674         个单词上限2024-08-08 12:42:09
######## 8/8/2024, 12:42:23 PM
tid=14850b1e3d1dd5ab8aeba8a6aa1cc8c1

 【请求的 ip 】：172.183.84.71
 【 用  户 】 加了  674         个单词上限2024-08-08 14:43:31
######## 8/8/2024, 2:43:45 PM
tid=14850b1e3d1dd5ab8aeba8a6aa1cc8c1

 【请求的 ip 】：172.183.108.33
 【 用  户 】 加了  674         个单词上限2024-08-08 15:39:27
######## 8/8/2024, 3:39:41 PM
tid=14850b1e3d1dd5ab8aeba8a6aa1cc8c1

 【请求的 ip 】：40.67.133.147
 【 用  户 】 加了  674         个单词上限2024-08-08 17:39:19
######## 8/8/2024, 5:39:34 PM
tid=14850b1e3d1dd5ab8aeba8a6aa1cc8c1

 【请求的 ip 】：20.55.223.40
 【 用  户 】 加了  674         个单词上限2024-08-08 18:40:39
######## 8/8/2024, 6:40:52 PM
tid=374b83ccb33eed3e74abd6475d80c641

 【请求的 ip 】：13.91.68.162
 【 用  户 】 加了  677         个单词上限2024-08-09 12:41:24
######## 8/9/2024, 12:41:39 PM
tid=374b83ccb33eed3e74abd6475d80c641

 【请求的 ip 】：172.183.113.199
 【 用  户 】 加了  677         个单词上限2024-08-09 14:44:07
######## 8/9/2024, 2:44:22 PM
tid=20fd861ad389945a983064304c7f041a

 【请求的 ip 】：20.51.159.39
 【 用  户 】 加了  679         个单词上限2024-08-09 15:39:28
######## 8/9/2024, 3:39:42 PM
tid=20fd861ad389945a983064304c7f041a

 【请求的 ip 】：20.102.46.218
 【 用  户 】 加了  679         个单词上限2024-08-09 17:39:13
######## 8/9/2024, 5:39:27 PM
tid=20fd861ad389945a983064304c7f041a

 【请求的 ip 】：20.109.38.205
 【 用  户 】 加了  679         个单词上限2024-08-09 18:40:53
######## 8/9/2024, 6:41:07 PM
tid=20fd861ad389945a983064304c7f041a

 【请求的 ip 】：20.102.46.149
 【 用  户 】 加了  679         个单词上限2024-08-10 12:43:32
######## 8/10/2024, 12:43:45 PM
tid=20fd861ad389945a983064304c7f041a

 【请求的 ip 】：52.234.33.183
 【 用  户 】 加了  681         个单词上限2024-08-10 14:42:52
######## 8/10/2024, 2:43:07 PM
tid=20fd861ad389945a983064304c7f041a

 【请求的 ip 】：74.249.13.128
 【 用  户 】 加了  681         个单词上限2024-08-10 15:39:16
######## 8/10/2024, 3:39:30 PM
tid=20fd861ad389945a983064304c7f041a

 【请求的 ip 】：20.172.6.211
 【 用  户 】 加了  681         个单词上限2024-08-10 17:39:21
######## 8/10/2024, 5:39:35 PM
tid=20fd861ad389945a983064304c7f041a

 【请求的 ip 】：172.214.252.32
 【 用  户 】 加了  681         个单词上限2024-08-10 18:40:11
######## 8/10/2024, 6:40:26 PM
tid=20fd861ad389945a983064304c7f041a

 【请求的 ip 】：20.81.159.18
 【 用  户 】 加了  681         个单词上限2024-08-11 12:41:02
######## 8/11/2024, 12:41:16 PM
tid=91b90bdeec3f79ad32d1236de5cc394b

 【请求的 ip 】：20.109.39.133
 【 用  户 】 加了  684         个单词上限2024-08-11 14:42:27
######## 8/11/2024, 2:42:42 PM
tid=91b90bdeec3f79ad32d1236de5cc394b

 【请求的 ip 】：20.161.78.51
 【 用  户 】 加了  684         个单词上限2024-08-11 15:39:20
######## 8/11/2024, 3:39:34 PM
tid=91b90bdeec3f79ad32d1236de5cc394b

 【请求的 ip 】：20.51.159.47
 【 用  户 】 加了  684         个单词上限2024-08-11 17:39:15
######## 8/11/2024, 5:39:29 PM
tid=91b90bdeec3f79ad32d1236de5cc394b

 【请求的 ip 】：4.242.241.141
 【 用  户 】 加了  684         个单词上限2024-08-11 18:39:50
######## 8/11/2024, 6:40:03 PM
tid=91b90bdeec3f79ad32d1236de5cc394b

 【请求的 ip 】：52.238.27.209
 【 用  户 】 加了  684         个单词上限2024-08-12 12:41:33
######## 8/12/2024, 12:41:47 PM
tid=91b90bdeec3f79ad32d1236de5cc394b

 【请求的 ip 】：74.249.13.179
 【 用  户 】 加了  684         个单词上限2024-08-12 14:43:36
######## 8/12/2024, 2:43:50 PM
tid=91b90bdeec3f79ad32d1236de5cc394b

 【请求的 ip 】：74.249.13.142
 【 用  户 】 加了  684         个单词上限2024-08-12 15:39:28
######## 8/12/2024, 3:39:42 PM
tid=91b90bdeec3f79ad32d1236de5cc394b

 【请求的 ip 】：20.171.122.32
 【 用  户 】 加了  684         个单词上限2024-08-12 17:39:20
######## 8/12/2024, 5:39:34 PM
tid=91b90bdeec3f79ad32d1236de5cc394b

 【请求的 ip 】：20.97.191.38
 【 用  户 】 加了  684         个单词上限2024-08-12 18:41:30
######## 8/12/2024, 6:41:44 PM
tid=91b90bdeec3f79ad32d1236de5cc394b

 【请求的 ip 】：52.157.14.194
 【 用  户 】 加了  684         个单词上限2024-08-13 12:41:09
######## 8/13/2024, 12:41:22 PM
tid=1e5bb00f88b921b0ea83f4fc183af8dd

 【请求的 ip 】：20.102.214.33
 【 用  户 】 加了  687         个单词上限2024-08-13 14:44:06
######## 8/13/2024, 2:44:20 PM
tid=1e5bb00f88b921b0ea83f4fc183af8dd

 【请求的 ip 】：172.183.82.192
 【 用  户 】 加了  687         个单词上限2024-08-13 15:39:50
######## 8/13/2024, 3:40:04 PM
tid=1e5bb00f88b921b0ea83f4fc183af8dd

 【请求的 ip 】：20.55.15.47
 【 用  户 】 加了  687         个单词上限2024-08-13 17:40:03
######## 8/13/2024, 5:40:16 PM
tid=64e24a9585e8d235993827eb2a1c842a

 【请求的 ip 】：172.183.132.16
 【 用  户 】 加了  690         个单词上限2024-08-13 18:41:45
######## 8/13/2024, 6:41:59 PM
tid=64e24a9585e8d235993827eb2a1c842a

 【请求的 ip 】：20.97.189.17
 【 用  户 】 加了  690         个单词上限2024-08-14 12:41:11
######## 8/14/2024, 12:41:25 PM
tid=54882ff2f6d1b7d47e2a808a11164099

 【请求的 ip 】：20.51.207.129
 【 用  户 】 加了  692         个单词上限2024-08-14 14:42:58
######## 8/14/2024, 2:43:12 PM
tid=54882ff2f6d1b7d47e2a808a11164099

 【请求的 ip 】：20.55.118.209
 【 用  户 】 加了  692         个单词上限2024-08-14 15:39:21
######## 8/14/2024, 3:39:33 PM
tid=54882ff2f6d1b7d47e2a808a11164099

 【请求的 ip 】：20.253.152.177
 【 用  户 】 加了  692         个单词上限2024-08-14 17:39:14
######## 8/14/2024, 5:39:27 PM
tid=54882ff2f6d1b7d47e2a808a11164099

 【请求的 ip 】：20.109.39.179
 【 用  户 】 加了  692         个单词上限2024-08-14 18:41:06
######## 8/14/2024, 6:41:21 PM
tid=54882ff2f6d1b7d47e2a808a11164099

 【请求的 ip 】：20.161.78.231
 【 用  户 】 加了  692         个单词上限2024-08-15 12:41:40
######## 8/15/2024, 12:41:55 PM
tid=54882ff2f6d1b7d47e2a808a11164099

 【请求的 ip 】：20.57.14.21
 【 用  户 】 加了  692         个单词上限2024-08-15 14:44:16
######## 8/15/2024, 2:44:29 PM
tid=54882ff2f6d1b7d47e2a808a11164099

 【请求的 ip 】：13.87.243.38
 【 用  户 】 加了  692         个单词上限2024-08-15 15:39:45
######## 8/15/2024, 3:39:59 PM
tid=54882ff2f6d1b7d47e2a808a11164099

 【请求的 ip 】：172.183.154.109
 【 用  户 】 加了  692         个单词上限2024-08-15 17:39:12
######## 8/15/2024, 5:39:25 PM
tid=54882ff2f6d1b7d47e2a808a11164099

 【请求的 ip 】：172.183.131.202
 【 用  户 】 加了  692         个单词上限2024-08-15 18:41:44
######## 8/15/2024, 6:41:59 PM
tid=54882ff2f6d1b7d47e2a808a11164099

 【请求的 ip 】：172.183.53.180
 【 用  户 】 加了  692         个单词上限2024-08-16 12:41:08
######## 8/16/2024, 12:41:22 PM
tid=54882ff2f6d1b7d47e2a808a11164099

 【请求的 ip 】：52.234.33.178
 【 用  户 】 加了  695         个单词上限2024-08-16 14:43:21
######## 8/16/2024, 2:43:36 PM
tid=54882ff2f6d1b7d47e2a808a11164099

 【请求的 ip 】：172.183.37.89
 【 用  户 】 加了  695         个单词上限2024-08-16 15:39:30
######## 8/16/2024, 3:39:44 PM
tid=453d2905a7f981107f26b85145fa539f

 【请求的 ip 】：172.206.110.211
 【 用  户 】 加了  695         个单词上限2024-08-16 17:39:26
######## 8/16/2024, 5:39:42 PM
tid=453d2905a7f981107f26b85145fa539f

 【请求的 ip 】：172.183.131.30
 【 用  户 】 加了  695         个单词上限2024-08-16 18:40:57
######## 8/16/2024, 6:41:11 PM
tid=453d2905a7f981107f26b85145fa539f

 【请求的 ip 】：20.12.6.220
 【 用  户 】 加了  695         个单词上限2024-08-17 12:41:16
######## 8/17/2024, 12:41:29 PM
tid=362112b2a378803cc3819c703e4d2070

 【请求的 ip 】：20.171.78.148
 【 用  户 】 加了  698         个单词上限2024-08-17 14:41:18
######## 8/17/2024, 2:41:32 PM
tid=362112b2a378803cc3819c703e4d2070

 【请求的 ip 】：20.97.189.18
 【 用  户 】 加了  698         个单词上限2024-08-17 15:39:11
######## 8/17/2024, 3:39:25 PM
tid=362112b2a378803cc3819c703e4d2070

 【请求的 ip 】：172.183.74.5
 【 用  户 】 加了  698         个单词上限2024-08-17 17:39:18
######## 8/17/2024, 5:39:31 PM
tid=362112b2a378803cc3819c703e4d2070

 【请求的 ip 】：40.76.119.2
 【 用  户 】 加了  698         个单词上限2024-08-17 18:40:21
######## 8/17/2024, 6:40:34 PM
tid=362112b2a378803cc3819c703e4d2070

 【请求的 ip 】：20.172.46.70
 【 用  户 】 加了  698         个单词上限2024-08-18 11:55:46
######## 8/18/2024, 11:56:01 AM
tid=362112b2a378803cc3819c703e4d2070

 【请求的 ip 】：20.81.159.83
 【 用  户 】 加了  698         个单词上限2024-08-18 12:41:16
######## 8/18/2024, 12:41:30 PM
tid=1e213d53d69c2db229205896810d68e2

 【请求的 ip 】：172.183.88.184
 【 用  户 】 加了  701         个单词上限2024-08-18 14:41:56
######## 8/18/2024, 2:42:09 PM
tid=1e213d53d69c2db229205896810d68e2

 【请求的 ip 】：52.234.38.75
 【 用  户 】 加了  701         个单词上限2024-08-18 15:39:14
######## 8/18/2024, 3:39:29 PM
tid=1e213d53d69c2db229205896810d68e2

 【请求的 ip 】：20.55.118.240
 【 用  户 】 加了  701         个单词上限2024-08-18 17:39:22
######## 8/18/2024, 5:39:36 PM
tid=1e213d53d69c2db229205896810d68e2

 【请求的 ip 】：172.200.199.169
 【 用  户 】 加了  701         个单词上限2024-08-18 18:39:29
######## 8/18/2024, 6:39:43 PM
tid=1e213d53d69c2db229205896810d68e2

 【请求的 ip 】：172.183.130.193
 【 用  户 】 加了  701         个单词上限2024-08-19 12:41:05
######## 8/19/2024, 12:41:18 PM
tid=aed5f4c780ab3f76b5b9fd2ecd0d99e6

 【请求的 ip 】：172.183.50.149
 【 用  户 】 加了  704         个单词上限2024-08-19 14:44:04
######## 8/19/2024, 2:44:18 PM
tid=aed5f4c780ab3f76b5b9fd2ecd0d99e6

 【请求的 ip 】：20.109.38.150
 【 用  户 】 加了  704         个单词上限2024-08-19 15:39:35
######## 8/19/2024, 3:39:49 PM
tid=aed5f4c780ab3f76b5b9fd2ecd0d99e6

 【请求的 ip 】：20.161.61.210
 【 用  户 】 加了  704         个单词上限2024-08-19 17:39:20
######## 8/19/2024, 5:39:33 PM
tid=aed5f4c780ab3f76b5b9fd2ecd0d99e6

 【请求的 ip 】：52.159.137.11
 【 用  户 】 加了  704         个单词上限2024-08-19 18:42:19
######## 8/19/2024, 6:42:33 PM
tid=aed5f4c780ab3f76b5b9fd2ecd0d99e6

 【请求的 ip 】：20.161.78.42
 【 用  户 】 加了  704         个单词上限2024-08-20 12:43:22
######## 8/20/2024, 12:43:35 PM
tid=aed5f4c780ab3f76b5b9fd2ecd0d99e6

 【请求的 ip 】：52.238.27.193
 【 用  户 】 加了  704         个单词上限2024-08-20 14:43:22
######## 8/20/2024, 2:43:36 PM
tid=aed5f4c780ab3f76b5b9fd2ecd0d99e6

 【请求的 ip 】：40.71.163.77
 【 用  户 】 加了  704         个单词上限2024-08-20 15:39:24
######## 8/20/2024, 3:39:39 PM
tid=aed5f4c780ab3f76b5b9fd2ecd0d99e6

 【请求的 ip 】：20.172.5.80
 【 用  户 】 加了  704         个单词上限2024-08-20 17:39:14
######## 8/20/2024, 5:39:28 PM
tid=aed5f4c780ab3f76b5b9fd2ecd0d99e6

 【请求的 ip 】：20.171.70.48
 【 用  户 】 加了  704         个单词上限2024-08-20 18:42:09
######## 8/20/2024, 6:42:23 PM
tid=aed5f4c780ab3f76b5b9fd2ecd0d99e6

 【请求的 ip 】：20.109.39.180
 【 用  户 】 加了  704         个单词上限2024-08-21 12:41:58
######## 8/21/2024, 12:42:11 PM
tid=aed5f4c780ab3f76b5b9fd2ecd0d99e6

 【请求的 ip 】：172.183.107.210
 【 用  户 】 加了  707         个单词上限2024-08-21 14:43:04
######## 8/21/2024, 2:43:17 PM
tid=04edb7bbbb329ee1e307b14c7e4d076f

 【请求的 ip 】：172.183.112.123
 【 用  户 】 加了  707         个单词上限2024-08-21 15:39:39
######## 8/21/2024, 3:39:54 PM
tid=04edb7bbbb329ee1e307b14c7e4d076f

 【请求的 ip 】：20.102.46.218
 【 用  户 】 加了  707         个单词上限2024-08-21 17:39:26
######## 8/21/2024, 5:39:39 PM
tid=04edb7bbbb329ee1e307b14c7e4d076f

 【请求的 ip 】：52.234.33.125
 【 用  户 】 加了  707         个单词上限2024-08-21 18:40:38
######## 8/21/2024, 6:40:51 PM
tid=04edb7bbbb329ee1e307b14c7e4d076f

 【请求的 ip 】：172.183.106.48
 【 用  户 】 加了  707         个单词上限2024-08-22 12:41:19
######## 8/22/2024, 12:41:32 PM
tid=04edb7bbbb329ee1e307b14c7e4d076f

 【请求的 ip 】：13.91.68.144
 【 用  户 】 加了  707         个单词上限2024-08-22 14:44:18
######## 8/22/2024, 2:44:31 PM
tid=04edb7bbbb329ee1e307b14c7e4d076f

 【请求的 ip 】：52.234.27.6
 【 用  户 】 加了  710         个单词上限2024-08-22 15:39:16
######## 8/22/2024, 3:39:31 PM
tid=04edb7bbbb329ee1e307b14c7e4d076f

 【请求的 ip 】：20.55.223.81
 【 用  户 】 加了  710         个单词上限2024-08-22 17:39:30
######## 8/22/2024, 5:39:43 PM
tid=04edb7bbbb329ee1e307b14c7e4d076f

 【请求的 ip 】：13.86.227.243
 【 用  户 】 加了  710         个单词上限2024-08-22 18:43:21
######## 8/22/2024, 6:43:34 PM
tid=04edb7bbbb329ee1e307b14c7e4d076f

 【请求的 ip 】：20.55.15.41
 【 用  户 】 加了  710         个单词上限2024-08-23 12:41:42
######## 8/23/2024, 12:41:56 PM
tid=4ceaf41083fcdc10ae65a8ffa5cd3606

 【请求的 ip 】：57.154.160.49
 【 用  户 】 加了  713         个单词上限2024-08-23 14:43:12
######## 8/23/2024, 2:43:26 PM
tid=4ceaf41083fcdc10ae65a8ffa5cd3606

 【请求的 ip 】：20.161.77.197
 【 用  户 】 加了  713         个单词上限2024-08-23 15:39:46
######## 8/23/2024, 3:39:59 PM
tid=4ceaf41083fcdc10ae65a8ffa5cd3606

 【请求的 ip 】：13.91.68.93
 【 用  户 】 加了  713         个单词上限2024-08-23 17:39:15
######## 8/23/2024, 5:39:28 PM
tid=4ceaf41083fcdc10ae65a8ffa5cd3606

 【请求的 ip 】：52.238.25.50
 【 用  户 】 加了  713         个单词上限2024-08-23 18:40:51
######## 8/23/2024, 6:41:05 PM
tid=4ceaf41083fcdc10ae65a8ffa5cd3606

 【请求的 ip 】：74.249.5.226
 【 用  户 】 加了  713         个单词上限2024-08-24 12:41:35
######## 8/24/2024, 12:41:49 PM
tid=4ceaf41083fcdc10ae65a8ffa5cd3606

 【请求的 ip 】：172.214.176.91
 【 用  户 】 加了  713         个单词上限2024-08-24 14:42:04
######## 8/24/2024, 2:42:17 PM
tid=4ceaf41083fcdc10ae65a8ffa5cd3606

 【请求的 ip 】：52.234.26.80
 【 用  户 】 加了  716         个单词上限2024-08-24 15:39:39
######## 8/24/2024, 3:39:53 PM
tid=4ceaf41083fcdc10ae65a8ffa5cd3606

 【请求的 ip 】：74.249.5.228
 【 用  户 】 加了  716         个单词上限2024-08-24 17:39:23
######## 8/24/2024, 5:39:37 PM
tid=4ceaf41083fcdc10ae65a8ffa5cd3606

 【请求的 ip 】：172.183.147.225
 【 用  户 】 加了  716         个单词上限2024-08-24 18:39:37
######## 8/24/2024, 6:39:53 PM
tid=4ceaf41083fcdc10ae65a8ffa5cd3606

 【请求的 ip 】：172.190.111.247
 【 用  户 】 加了  716         个单词上限2024-08-25 12:41:33
######## 8/25/2024, 12:41:47 PM
tid=4ceaf41083fcdc10ae65a8ffa5cd3606

 【请求的 ip 】：172.183.113.197
 【 用  户 】 加了  719         个单词上限2024-08-25 14:42:31
######## 8/25/2024, 2:42:46 PM
tid=4ceaf41083fcdc10ae65a8ffa5cd3606

 【请求的 ip 】：20.55.126.45
 【 用  户 】 加了  719         个单词上限2024-08-25 15:39:15
######## 8/25/2024, 3:39:29 PM
tid=4ceaf41083fcdc10ae65a8ffa5cd3606

 【请求的 ip 】：172.183.146.93
 【 用  户 】 加了  719         个单词上限2024-08-25 17:39:25
######## 8/25/2024, 5:39:38 PM
tid=4ceaf41083fcdc10ae65a8ffa5cd3606

 【请求的 ip 】：13.91.68.223
 【 用  户 】 加了  719         个单词上限2024-08-25 18:40:23
######## 8/25/2024, 6:40:37 PM
tid=4ceaf41083fcdc10ae65a8ffa5cd3606

 【请求的 ip 】：172.183.112.119
 【 用  户 】 加了  719         个单词上限2024-08-26 12:43:46
######## 8/26/2024, 12:44:01 PM
tid=4ceaf41083fcdc10ae65a8ffa5cd3606

 【请求的 ip 】：172.183.98.202
 【 用  户 】 加了  719         个单词上限2024-08-26 14:44:09
######## 8/26/2024, 2:44:23 PM
tid=4ceaf41083fcdc10ae65a8ffa5cd3606

 【请求的 ip 】：20.172.43.101
 【 用  户 】 加了  719         个单词上限2024-08-26 15:39:56
######## 8/26/2024, 3:40:09 PM
tid=4ceaf41083fcdc10ae65a8ffa5cd3606

 【请求的 ip 】：172.183.154.102
 【 用  户 】 加了  719         个单词上限2024-08-26 17:39:25
######## 8/26/2024, 5:39:39 PM
tid=4ceaf41083fcdc10ae65a8ffa5cd3606

 【请求的 ip 】：172.183.106.48
 【 用  户 】 加了  719         个单词上限2024-08-26 18:43:13
######## 8/26/2024, 6:43:26 PM
tid=4ceaf41083fcdc10ae65a8ffa5cd3606

 【请求的 ip 】：172.182.232.58
 【 用  户 】 加了  719         个单词上限2025-10-02 18:38:06
######## 10/2/2025, 6:38:17 PM
tid=ff0f17c4502548640e8490493bef7f82

 【请求的 ip 】：20.109.38.54
 【 用  户 】 加了  0         个单词上限2025-10-02 18:43:51
######## 10/2/2025, 6:44:01 PM
tid=ff0f17c4502548640e8490493bef7f82

 【请求的 ip 】：172.212.169.147
 【 用  户 】 加了  0         个单词上限2025-10-02 18:45:29
######## 10/2/2025, 6:45:40 PM
tid=ff0f17c4502548640e8490493bef7f82

 【请求的 ip 】：57.151.137.150
 【 用  户 】 加了  0         个单词上限2025-10-02 19:44:59
######## 10/2/2025, 7:45:10 PM
tid=ff0f17c4502548640e8490493bef7f82

 【请求的 ip 】：135.232.201.36
 【 用  户 】 加了  0         个单词上限2025-10-03 12:44:14
######## 10/3/2025, 12:44:25 PM
tid=ff0f17c4502548640e8490493bef7f82

 【请求的 ip 】：64.236.134.53
 【 用  户 】 加了  0         个单词上限2025-10-03 14:49:50
######## 10/3/2025, 2:50:01 PM
tid=ff0f17c4502548640e8490493bef7f82

 【请求的 ip 】：4.236.173.16
 【 用  户 】 加了  0         个单词上限2025-10-03 15:41:32
######## 10/3/2025, 3:41:43 PM
tid=ff0f17c4502548640e8490493bef7f82

 【请求的 ip 】：64.236.200.102
 【 用  户 】 加了  3         个单词上限2025-10-03 17:41:58
######## 10/3/2025, 5:42:09 PM
tid=ff0f17c4502548640e8490493bef7f82

 【请求的 ip 】：132.196.82.135
 【 用  户 】 加了  3         个单词上限2025-10-03 18:43:50
######## 10/3/2025, 6:44:01 PM
tid=ff0f17c4502548640e8490493bef7f82

 【请求的 ip 】：172.215.210.232
 【 用  户 】 加了  3         个单词上限2025-10-03 22:47:01
######## 10/3/2025, 10:47:12 PM
tid=0e4287c91a34654cc50f79bbf5025630

 【请求的 ip 】：4.246.135.35
 【 用  户 】 加了  3         个单词上限2025-10-04 12:43:55
######## 10/4/2025, 12:44:06 PM
tid=0e4287c91a34654cc50f79bbf5025630

 【请求的 ip 】：64.236.140.195
 【 用  户 】 加了  3         个单词上限2025-10-04 14:46:47
######## 10/4/2025, 2:46:57 PM
tid=0e4287c91a34654cc50f79bbf5025630

 【请求的 ip 】：135.232.184.208
 【 用  户 】 加了  3         个单词上限2025-10-04 15:26:01
######## 10/4/2025, 3:26:12 PM
tid=1f5b88a99da94a081e156b66f6135337

 【请求的 ip 】：52.173.162.100
 【 用  户 】 加了  6         个单词上限2025-10-04 15:44:23
######## 10/4/2025, 3:44:35 PM
tid=1f5b88a99da94a081e156b66f6135337

 【请求的 ip 】：68.220.57.96
 【 用  户 】 加了  6         个单词上限2025-10-04 16:18:09
######## 10/4/2025, 4:18:19 PM
tid=1f5b88a99da94a081e156b66f6135337

 【请求的 ip 】：52.159.245.147
 【 用  户 】 加了  6         个单词上限2025-10-04 16:36:02
######## 10/4/2025, 4:36:13 PM
tid=1f5b88a99da94a081e156b66f6135337

 【请求的 ip 】：74.249.78.161
 【 用  户 】 加了  6         个单词上限2025-10-04 16:46:42
######## 10/4/2025, 4:46:53 PM
tid=1f5b88a99da94a081e156b66f6135337

 【请求的 ip 】：135.232.200.65
 【 用  户 】 加了  6         个单词上限2025-10-04 17:14:30
######## 10/4/2025, 5:14:41 PM
tid=1f5b88a99da94a081e156b66f6135337

 【请求的 ip 】：64.236.141.179
 【 用  户 】 加了  6         个单词上限2025-10-04 17:29:06
######## 10/4/2025, 5:29:17 PM
tid=1f5b88a99da94a081e156b66f6135337

 【请求的 ip 】：52.165.251.246
 【 用  户 】 加了  6         个单词上限2025-10-04 17:44:14
######## 10/4/2025, 5:44:25 PM
tid=1f5b88a99da94a081e156b66f6135337

 【请求的 ip 】：172.184.213.227
 【 用  户 】 加了  6         个单词上限2025-10-04 18:14:32
######## 10/4/2025, 6:14:42 PM
tid=1f5b88a99da94a081e156b66f6135337

 【请求的 ip 】：52.159.247.229
 【 用  户 】 加了  6         个单词上限2025-10-04 18:32:43
######## 10/4/2025, 6:32:53 PM
tid=1f5b88a99da94a081e156b66f6135337

 【请求的 ip 】：52.161.74.196
 【 用  户 】 加了  6         个单词上限2025-10-04 18:44:51
######## 10/4/2025, 6:45:02 PM
tid=1f5b88a99da94a081e156b66f6135337

 【请求的 ip 】：135.232.200.6
 【 用  户 】 加了  6         个单词上限2025-10-04 19:11:43
######## 10/4/2025, 7:11:54 PM
tid=1f5b88a99da94a081e156b66f6135337

 【请求的 ip 】：172.184.220.213
 【 用  户 】 加了  6         个单词上限2025-10-04 19:25:07
######## 10/4/2025, 7:25:18 PM
tid=1f5b88a99da94a081e156b66f6135337

 【请求的 ip 】：52.154.20.195
 【 用  户 】 加了  6         个单词上限2025-10-04 19:44:29
######## 10/4/2025, 7:44:40 PM
tid=1f5b88a99da94a081e156b66f6135337

 【请求的 ip 】：64.236.200.96
 【 用  户 】 加了  6         个单词上限2025-10-04 20:29:18
######## 10/4/2025, 8:29:30 PM
tid=1f5b88a99da94a081e156b66f6135337

 【请求的 ip 】：52.190.183.86
 【 用  户 】 加了  6         个单词上限2025-10-04 21:00:31
######## 10/4/2025, 9:00:41 PM
tid=1f5b88a99da94a081e156b66f6135337

 【请求的 ip 】：104.209.10.225
 【 用  户 】 加了  6         个单词上限2025-10-04 21:31:08
######## 10/4/2025, 9:31:19 PM
tid=1f5b88a99da94a081e156b66f6135337

 【请求的 ip 】：52.173.237.212
 【 用  户 】 加了  6         个单词上限2025-10-04 21:44:21
######## 10/4/2025, 9:44:32 PM
tid=1f5b88a99da94a081e156b66f6135337

 【请求的 ip 】：172.184.211.241
 【 用  户 】 加了  6         个单词上限2025-10-04 22:13:09
######## 10/4/2025, 10:13:20 PM
tid=1f5b88a99da94a081e156b66f6135337

 【请求的 ip 】：128.24.162.3
 【 用  户 】 加了  6         个单词上限2025-10-04 22:30:01
######## 10/4/2025, 10:30:12 PM
tid=1f5b88a99da94a081e156b66f6135337

 【请求的 ip 】：52.173.219.146
 【 用  户 】 加了  6         个单词上限2025-10-04 22:44:37
######## 10/4/2025, 10:44:48 PM
tid=1f5b88a99da94a081e156b66f6135337

 【请求的 ip 】：52.161.75.164
 【 用  户 】 加了  6         个单词上限2025-10-04 23:13:19
######## 10/4/2025, 11:13:30 PM
tid=1f5b88a99da94a081e156b66f6135337

 【请求的 ip 】：64.236.143.210
 【 用  户 】 加了  6         个单词上限2025-10-04 23:29:00
######## 10/4/2025, 11:29:11 PM
tid=1f5b88a99da94a081e156b66f6135337

 【请求的 ip 】：68.220.58.148
 【 用  户 】 加了  6         个单词上限2025-10-04 23:44:10
######## 10/4/2025, 11:44:21 PM
tid=1f5b88a99da94a081e156b66f6135337

 【请求的 ip 】：172.182.195.131
 【 用  户 】 加了  6         个单词上限2025-10-05 00:17:38
######## 10/5/2025, 12:17:50 AM
tid=1f5b88a99da94a081e156b66f6135337

 【请求的 ip 】：52.165.213.183
 【 用  户 】 加了  6         个单词上限2025-10-05 00:36:27
######## 10/5/2025, 12:36:38 AM
tid=1f5b88a99da94a081e156b66f6135337

 【请求的 ip 】：48.214.54.98
 【 用  户 】 加了  6         个单词上限2025-10-05 00:46:15
######## 10/5/2025, 12:46:26 AM
tid=1f5b88a99da94a081e156b66f6135337

 【请求的 ip 】：4.246.135.163
 【 用  户 】 加了  6         个单词上限2025-10-05 01:12:12
######## 10/5/2025, 1:12:24 AM
tid=1f5b88a99da94a081e156b66f6135337

 【请求的 ip 】：64.236.134.20
 【 用  户 】 加了  6         个单词上限2025-10-05 01:28:08
######## 10/5/2025, 1:28:19 AM
tid=1f5b88a99da94a081e156b66f6135337

 【请求的 ip 】：64.236.135.115
 【 用  户 】 加了  6         个单词上限2025-10-05 01:44:15
######## 10/5/2025, 1:44:26 AM
tid=1f5b88a99da94a081e156b66f6135337

 【请求的 ip 】：68.154.119.209
 【 用  户 】 加了  6         个单词上限2025-10-05 02:20:37
######## 10/5/2025, 2:20:49 AM
tid=1f5b88a99da94a081e156b66f6135337

 【请求的 ip 】：52.173.237.212
 【 用  户 】 加了  6         个单词上限2025-10-05 02:47:35
######## 10/5/2025, 2:47:46 AM
tid=1f5b88a99da94a081e156b66f6135337

 【请求的 ip 】：172.184.204.101
 【 用  户 】 加了  6         个单词上限2025-10-05 03:11:01
######## 10/5/2025, 3:11:12 AM
tid=1f5b88a99da94a081e156b66f6135337

 【请求的 ip 】：64.236.141.210
 【 用  户 】 加了  6         个单词上限2025-10-05 03:24:23
######## 10/5/2025, 3:24:34 AM
tid=1f5b88a99da94a081e156b66f6135337

 【请求的 ip 】：20.49.14.178
 【 用  户 】 加了  6         个单词上限2025-10-05 03:44:00
######## 10/5/2025, 3:44:10 AM
tid=1f5b88a99da94a081e156b66f6135337

 【请求的 ip 】：172.172.87.242
 【 用  户 】 加了  6         个单词上限2025-10-05 04:15:33
######## 10/5/2025, 4:15:43 AM
tid=1f5b88a99da94a081e156b66f6135337

 【请求的 ip 】：20.161.44.179
 【 用  户 】 加了  6         个单词上限2025-10-05 04:31:04
######## 10/5/2025, 4:31:14 AM
tid=1f5b88a99da94a081e156b66f6135337

 【请求的 ip 】：132.196.19.21
 【 用  户 】 加了  6         个单词上限2025-10-05 04:44:18
######## 10/5/2025, 4:44:28 AM
tid=1f5b88a99da94a081e156b66f6135337

 【请求的 ip 】：64.236.134.208
 【 用  户 】 加了  6         个单词上限2025-10-05 05:12:40
######## 10/5/2025, 5:12:51 AM
tid=1f5b88a99da94a081e156b66f6135337

 【请求的 ip 】：20.49.61.50
 【 用  户 】 加了  6         个单词上限2025-10-05 05:26:41
######## 10/5/2025, 5:26:52 AM
tid=1f5b88a99da94a081e156b66f6135337

 【请求的 ip 】：48.214.53.114
 【 用  户 】 加了  6         个单词上限2025-10-05 05:44:05
######## 10/5/2025, 5:44:16 AM
tid=1f5b88a99da94a081e156b66f6135337

 【请求的 ip 】：64.236.161.17
 【 用  户 】 加了  6         个单词上限2025-10-05 06:13:17
######## 10/5/2025, 6:13:27 AM
tid=1f5b88a99da94a081e156b66f6135337

 【请求的 ip 】：20.109.38.162
 【 用  户 】 加了  6         个单词上限2025-10-05 06:30:58
######## 10/5/2025, 6:31:10 AM
tid=1f5b88a99da94a081e156b66f6135337

 【请求的 ip 】：172.215.216.198
 【 用  户 】 加了  6         个单词上限2025-10-05 06:44:44
######## 10/5/2025, 6:44:55 AM
tid=1f5b88a99da94a081e156b66f6135337

 【请求的 ip 】：132.196.82.132
 【 用  户 】 加了  6         个单词上限2025-10-05 07:13:54
######## 10/5/2025, 7:14:04 AM
tid=1f5b88a99da94a081e156b66f6135337

 【请求的 ip 】：172.182.226.227
 【 用  户 】 加了  6         个单词上限2025-10-05 07:28:22
######## 10/5/2025, 7:28:33 AM
tid=1f5b88a99da94a081e156b66f6135337

 【请求的 ip 】：20.109.38.163
 【 用  户 】 加了  6         个单词上限2025-10-05 07:44:04
######## 10/5/2025, 7:44:15 AM
tid=1f5b88a99da94a081e156b66f6135337

 【请求的 ip 】：20.109.95.100
 【 用  户 】 加了  6         个单词上限2025-10-05 09:19:00
######## 10/5/2025, 9:19:12 AM
tid=1f5b88a99da94a081e156b66f6135337

 【请求的 ip 】：68.154.38.20
 【 用  户 】 加了  6         个单词上限2025-10-05 10:46:51
######## 10/5/2025, 10:47:02 AM
tid=1f5b88a99da94a081e156b66f6135337

 【请求的 ip 】：145.132.102.52
 【 用  户 】 加了  6         个单词上限2025-10-05 11:33:56
######## 10/5/2025, 11:34:07 AM
tid=1f5b88a99da94a081e156b66f6135337

 【请求的 ip 】：52.173.181.22
 【 用  户 】 加了  6         个单词上限2025-10-05 11:50:42
######## 10/5/2025, 11:50:53 AM
tid=1f5b88a99da94a081e156b66f6135337

 【请求的 ip 】：20.161.44.180
 【 用  户 】 加了  6         个单词上限2025-10-05 12:18:00
######## 10/5/2025, 12:18:11 PM
tid=1f5b88a99da94a081e156b66f6135337

 【请求的 ip 】：52.159.226.244
 【 用  户 】 加了  6         个单词上限2025-10-05 12:35:23
######## 10/5/2025, 12:35:34 PM
tid=1f5b88a99da94a081e156b66f6135337

 【请求的 ip 】：20.81.183.82
 【 用  户 】 加了  6         个单词上限2025-10-05 12:45:05
######## 10/5/2025, 12:45:16 PM
tid=1f5b88a99da94a081e156b66f6135337

 【请求的 ip 】：172.182.226.22
 【 用  户 】 加了  6         个单词上限2025-10-05 13:14:21
######## 10/5/2025, 1:14:32 PM
tid=1f5b88a99da94a081e156b66f6135337

 【请求的 ip 】：172.184.213.160
 【 用  户 】 加了  6         个单词上限2025-10-05 13:31:09
######## 10/5/2025, 1:31:19 PM
tid=1f5b88a99da94a081e156b66f6135337

 【请求的 ip 】：52.159.247.48
 【 用  户 】 加了  6         个单词上限2025-10-05 13:44:23
######## 10/5/2025, 1:44:34 PM
tid=1f5b88a99da94a081e156b66f6135337

 【请求的 ip 】：4.246.135.0
 【 用  户 】 加了  6         个单词上限2025-10-05 14:21:47
######## 10/5/2025, 2:21:59 PM
tid=1f5b88a99da94a081e156b66f6135337

 【请求的 ip 】：20.171.123.133
 【 用  户 】 加了  9         个单词上限2025-10-05 14:48:00
######## 10/5/2025, 2:48:10 PM
tid=1f5b88a99da94a081e156b66f6135337

 【请求的 ip 】：52.159.247.164
 【 用  户 】 加了  9         个单词上限2025-10-05 15:13:25
######## 10/5/2025, 3:13:36 PM
tid=1f5b88a99da94a081e156b66f6135337

 【请求的 ip 】：48.214.54.114
 【 用  户 】 加了  9         个单词上限2025-10-05 15:27:13
######## 10/5/2025, 3:27:23 PM
tid=1f5b88a99da94a081e156b66f6135337

 【请求的 ip 】：172.172.87.242
 【 用  户 】 加了  9         个单词上限2025-10-05 15:44:14
######## 10/5/2025, 3:44:25 PM
tid=1f5b88a99da94a081e156b66f6135337

 【请求的 ip 】：172.174.223.246
 【 用  户 】 加了  9         个单词上限2025-10-05 16:18:28
######## 10/5/2025, 4:18:39 PM
tid=1f5b88a99da94a081e156b66f6135337

 【请求的 ip 】：64.236.141.212
 【 用  户 】 加了  9         个单词上限2025-10-05 16:36:01
######## 10/5/2025, 4:36:11 PM
tid=1f5b88a99da94a081e156b66f6135337

 【请求的 ip 】：52.234.45.180
 【 用  户 】 加了  9         个单词上限2025-10-05 16:46:04
######## 10/5/2025, 4:46:15 PM
tid=1f5b88a99da94a081e156b66f6135337

 【请求的 ip 】：135.232.232.53
 【 用  户 】 加了  9         个单词上限2025-10-05 17:14:03
######## 10/5/2025, 5:14:13 PM
tid=1f5b88a99da94a081e156b66f6135337

 【请求的 ip 】：172.183.131.18
 【 用  户 】 加了  9         个单词上限2025-10-05 17:28:39
######## 10/5/2025, 5:28:49 PM
tid=1f5b88a99da94a081e156b66f6135337

 【请求的 ip 】：135.232.225.18
 【 用  户 】 加了  9         个单词上限2025-10-05 17:44:57
######## 10/5/2025, 5:45:09 PM
tid=1f5b88a99da94a081e156b66f6135337

 【请求的 ip 】：135.232.200.70
 【 用  户 】 加了  9         个单词上限2025-10-05 18:15:01
######## 10/5/2025, 6:15:12 PM
tid=1f5b88a99da94a081e156b66f6135337

 【请求的 ip 】：64.236.169.4
 【 用  户 】 加了  9         个单词上限2025-10-05 18:32:28
######## 10/5/2025, 6:32:39 PM
tid=1f5b88a99da94a081e156b66f6135337

 【请求的 ip 】：172.184.211.21
 【 用  户 】 加了  9         个单词上限2025-10-05 18:44:47
######## 10/5/2025, 6:44:57 PM
tid=1f5b88a99da94a081e156b66f6135337

 【请求的 ip 】：135.232.201.83
 【 用  户 】 加了  9         个单词上限2025-10-05 19:11:35
######## 10/5/2025, 7:11:46 PM
tid=1f5b88a99da94a081e156b66f6135337

 【请求的 ip 】：172.178.118.84
 【 用  户 】 加了  9         个单词上限2025-10-05 19:25:05
######## 10/5/2025, 7:25:18 PM
tid=1f5b88a99da94a081e156b66f6135337

 【请求的 ip 】：68.220.59.48
 【 用  户 】 加了  9         个单词上限2025-10-05 19:44:20
######## 10/5/2025, 7:44:31 PM
tid=1f5b88a99da94a081e156b66f6135337

 【请求的 ip 】：52.176.35.114
 【 用  户 】 加了  9         个单词上限2025-10-05 20:29:22
######## 10/5/2025, 8:29:33 PM
tid=1f5b88a99da94a081e156b66f6135337

 【请求的 ip 】：172.182.212.3
 【 用  户 】 加了  9         个单词上限2025-10-05 21:01:06
######## 10/5/2025, 9:01:17 PM
tid=1f5b88a99da94a081e156b66f6135337

 【请求的 ip 】：172.182.195.37
 【 用  户 】 加了  9         个单词上限2025-10-05 21:31:17
######## 10/5/2025, 9:31:28 PM
tid=1f5b88a99da94a081e156b66f6135337

 【请求的 ip 】：64.236.200.228
 【 用  户 】 加了  9         个单词上限2025-10-05 21:44:14
######## 10/5/2025, 9:44:24 PM
tid=1f5b88a99da94a081e156b66f6135337

 【请求的 ip 】：172.178.119.36
 【 用  户 】 加了  9         个单词上限2025-10-05 22:12:55
######## 10/5/2025, 10:13:07 PM
tid=1f5b88a99da94a081e156b66f6135337

 【请求的 ip 】：135.119.237.65
 【 用  户 】 加了  9         个单词上限2025-10-05 22:30:19
######## 10/5/2025, 10:30:30 PM
tid=1f5b88a99da94a081e156b66f6135337

 【请求的 ip 】：145.132.100.180
 【 用  户 】 加了  9         个单词上限2025-10-05 22:44:43
######## 10/5/2025, 10:44:55 PM
tid=1f5b88a99da94a081e156b66f6135337

 【请求的 ip 】：40.116.73.179
 【 用  户 】 加了  9         个单词上限2025-10-05 23:13:47
######## 10/5/2025, 11:14:00 PM
tid=1f5b88a99da94a081e156b66f6135337

 【请求的 ip 】：172.215.211.20
 【 用  户 】 加了  9         个单词上限2025-10-05 23:28:29
######## 10/5/2025, 11:28:40 PM
tid=1f5b88a99da94a081e156b66f6135337

 【请求的 ip 】：135.232.177.117
 【 用  户 】 加了  9         个单词上限2025-10-05 23:44:24
######## 10/5/2025, 11:44:35 PM
tid=1f5b88a99da94a081e156b66f6135337

 【请求的 ip 】：20.161.45.114
 【 用  户 】 加了  9         个单词上限2025-10-06 00:17:16
######## 10/6/2025, 12:17:27 AM
tid=c171ba8e598d0d8971cfe8a20709ef8f

 【请求的 ip 】：68.154.38.18
 【 用  户 】 加了  9         个单词上限2025-10-06 00:35:53
######## 10/6/2025, 12:36:04 AM
tid=c171ba8e598d0d8971cfe8a20709ef8f

 【请求的 ip 】：52.176.35.116
 【 用  户 】 加了  9         个单词上限2025-10-06 00:45:44
######## 10/6/2025, 12:45:55 AM
tid=c171ba8e598d0d8971cfe8a20709ef8f

 【请求的 ip 】：52.150.28.34
 【 用  户 】 加了  9         个单词上限2025-10-06 01:12:19
######## 10/6/2025, 1:12:29 AM
tid=c171ba8e598d0d8971cfe8a20709ef8f

 【请求的 ip 】：64.236.177.98
 【 用  户 】 加了  9         个单词上限2025-10-06 01:28:40
######## 10/6/2025, 1:28:51 AM
tid=c171ba8e598d0d8971cfe8a20709ef8f

 【请求的 ip 】：64.236.177.5
 【 用  户 】 加了  9         个单词上限2025-10-06 01:44:11
######## 10/6/2025, 1:44:21 AM
tid=c171ba8e598d0d8971cfe8a20709ef8f

 【请求的 ip 】：172.174.223.242
 【 用  户 】 加了  9         个单词上限2025-10-06 02:20:14
######## 10/6/2025, 2:20:25 AM
tid=c171ba8e598d0d8971cfe8a20709ef8f

 【请求的 ip 】：172.172.87.49
 【 用  户 】 加了  9         个单词上限2025-10-06 02:47:16
######## 10/6/2025, 2:47:27 AM
tid=c171ba8e598d0d8971cfe8a20709ef8f

 【请求的 ip 】：64.236.169.1
 【 用  户 】 加了  9         个单词上限2025-10-06 03:11:34
######## 10/6/2025, 3:11:45 AM
tid=c171ba8e598d0d8971cfe8a20709ef8f

 【请求的 ip 】：40.65.61.34
 【 用  户 】 加了  9         个单词上限2025-10-06 03:25:02
######## 10/6/2025, 3:25:13 AM
tid=c171ba8e598d0d8971cfe8a20709ef8f

 【请求的 ip 】：172.215.217.99
 【 用  户 】 加了  9         个单词上限2025-10-06 03:44:48
######## 10/6/2025, 3:44:58 AM
tid=c171ba8e598d0d8971cfe8a20709ef8f

 【请求的 ip 】：20.55.87.176
 【 用  户 】 加了  9         个单词上限2025-10-06 04:15:45
######## 10/6/2025, 4:15:57 AM
tid=c171ba8e598d0d8971cfe8a20709ef8f

 【请求的 ip 】：172.208.62.164
 【 用  户 】 加了  9         个单词上限2025-10-06 04:31:12
######## 10/6/2025, 4:31:23 AM
tid=c171ba8e598d0d8971cfe8a20709ef8f

 【请求的 ip 】：52.159.247.68
 【 用  户 】 加了  9         个单词上限2025-10-06 04:44:41
######## 10/6/2025, 4:44:51 AM
tid=c171ba8e598d0d8971cfe8a20709ef8f

 【请求的 ip 】：172.178.119.16
 【 用  户 】 加了  9         个单词上限2025-10-06 05:12:52
######## 10/6/2025, 5:13:03 AM
tid=c171ba8e598d0d8971cfe8a20709ef8f

 【请求的 ip 】：172.182.195.83
 【 用  户 】 加了  9         个单词上限2025-10-06 05:27:11
######## 10/6/2025, 5:27:21 AM
tid=c171ba8e598d0d8971cfe8a20709ef8f

 【请求的 ip 】：52.159.247.147
 【 用  户 】 加了  9         个单词上限2025-10-06 05:44:27
######## 10/6/2025, 5:44:38 AM
tid=c171ba8e598d0d8971cfe8a20709ef8f

 【请求的 ip 】：40.65.59.113
 【 用  户 】 加了  9         个单词上限2025-10-06 06:14:00
######## 10/6/2025, 6:14:12 AM
tid=c171ba8e598d0d8971cfe8a20709ef8f

 【请求的 ip 】：52.159.229.52
 【 用  户 】 加了  9         个单词上限2025-10-06 06:31:22
######## 10/6/2025, 6:31:33 AM
tid=c171ba8e598d0d8971cfe8a20709ef8f

 【请求的 ip 】：64.236.135.130
 【 用  户 】 加了  9         个单词上限2025-10-06 06:44:36
######## 10/6/2025, 6:44:47 AM
tid=c171ba8e598d0d8971cfe8a20709ef8f

 【请求的 ip 】：20.49.13.179
 【 用  户 】 加了  9         个单词上限2025-10-06 07:12:40
######## 10/6/2025, 7:12:51 AM
tid=c171ba8e598d0d8971cfe8a20709ef8f

 【请求的 ip 】：172.174.167.16
 【 用  户 】 加了  9         个单词上限2025-10-06 07:26:28
######## 10/6/2025, 7:26:39 AM
tid=c171ba8e598d0d8971cfe8a20709ef8f

 【请求的 ip 】：135.232.177.192
 【 用  户 】 加了  9         个单词上限2025-10-06 07:44:53
######## 10/6/2025, 7:45:04 AM
tid=c171ba8e598d0d8971cfe8a20709ef8f

 【请求的 ip 】：68.220.58.147
 【 用  户 】 加了  9         个单词上限2025-10-06 09:13:52
######## 10/6/2025, 9:14:04 AM
tid=c171ba8e598d0d8971cfe8a20709ef8f

 【请求的 ip 】：135.119.237.71
 【 用  户 】 加了  9         个单词上限2025-10-06 10:40:57
######## 10/6/2025, 10:41:07 AM
tid=c171ba8e598d0d8971cfe8a20709ef8f

 【请求的 ip 】：172.184.174.113
 【 用  户 】 加了  9         个单词上限2025-10-06 11:32:20
######## 10/6/2025, 11:32:31 AM
tid=c171ba8e598d0d8971cfe8a20709ef8f

 【请求的 ip 】：145.132.102.100
 【 用  户 】 加了  9         个单词上限2025-10-06 11:51:24
######## 10/6/2025, 11:51:36 AM
tid=c171ba8e598d0d8971cfe8a20709ef8f

 【请求的 ip 】：20.51.198.200
 【 用  户 】 加了  9         个单词上限2025-10-06 12:18:52
######## 10/6/2025, 12:19:03 PM
tid=c171ba8e598d0d8971cfe8a20709ef8f

 【请求的 ip 】：172.182.196.56
 【 用  户 】 加了  9         个单词上限2025-10-06 12:38:02
######## 10/6/2025, 12:38:14 PM
tid=c171ba8e598d0d8971cfe8a20709ef8f

 【请求的 ip 】：4.236.159.148
 【 用  户 】 加了  9         个单词上限2025-10-06 12:48:19
######## 10/6/2025, 12:48:32 PM
tid=c171ba8e598d0d8971cfe8a20709ef8f

 【请求的 ip 】：64.236.134.231
 【 用  户 】 加了  9         个单词上限2025-10-06 13:15:53
######## 10/6/2025, 1:16:04 PM
tid=c171ba8e598d0d8971cfe8a20709ef8f

 【请求的 ip 】：172.184.174.117
 【 用  户 】 加了  9         个单词上限2025-10-06 13:33:23
######## 10/6/2025, 1:33:35 PM
tid=c171ba8e598d0d8971cfe8a20709ef8f

 【请求的 ip 】：172.184.210.246
 【 用  户 】 加了  9         个单词上限2025-10-06 13:44:47
######## 10/6/2025, 1:44:58 PM
tid=c171ba8e598d0d8971cfe8a20709ef8f

 【请求的 ip 】：64.236.143.211
 【 用  户 】 加了  9         个单词上限2025-10-06 14:25:16
######## 10/6/2025, 2:25:26 PM
tid=c171ba8e598d0d8971cfe8a20709ef8f

 【请求的 ip 】：40.65.61.37
 【 用  户 】 加了  9         个单词上限2025-10-06 14:52:44
######## 10/6/2025, 2:52:55 PM
tid=c171ba8e598d0d8971cfe8a20709ef8f

 【请求的 ip 】：172.208.152.210
 【 用  户 】 加了  9         个单词上限2025-10-06 15:16:55
######## 10/6/2025, 3:17:06 PM
tid=c171ba8e598d0d8971cfe8a20709ef8f

 【请求的 ip 】：172.208.153.24
 【 用  户 】 加了  9         个单词上限2025-10-06 15:32:07
######## 10/6/2025, 3:32:18 PM
tid=c171ba8e598d0d8971cfe8a20709ef8f

 【请求的 ip 】：20.171.123.131
 【 用  户 】 加了  9         个单词上限2025-10-06 15:44:18
######## 10/6/2025, 3:44:28 PM
tid=c171ba8e598d0d8971cfe8a20709ef8f

 【请求的 ip 】：135.232.200.4
 【 用  户 】 加了  9         个单词上限2025-10-06 16:22:04
######## 10/6/2025, 4:22:14 PM
tid=c171ba8e598d0d8971cfe8a20709ef8f

 【请求的 ip 】：135.232.225.18
 【 用  户 】 加了  9         个单词上限2025-10-06 16:51:15
######## 10/6/2025, 4:51:25 PM
tid=5bf464d091644fe7e68153e1c34d33e3

 【请求的 ip 】：20.55.126.248
 【 用  户 】 加了  12         个单词上限2025-10-06 17:19:38
######## 10/6/2025, 5:19:49 PM
tid=5bf464d091644fe7e68153e1c34d33e3

 【请求的 ip 】：48.211.212.213
 【 用  户 】 加了  12         个单词上限2025-10-06 17:37:53
######## 10/6/2025, 5:38:04 PM
tid=5bf464d091644fe7e68153e1c34d33e3

 【请求的 ip 】：145.132.102.56
 【 用  户 】 加了  12         个单词上限2025-10-06 17:47:46
######## 10/6/2025, 5:47:58 PM
tid=5bf464d091644fe7e68153e1c34d33e3

 【请求的 ip 】：172.172.86.227
 【 用  户 】 加了  12         个单词上限2025-10-06 18:17:52
######## 10/6/2025, 6:18:02 PM
tid=5bf464d091644fe7e68153e1c34d33e3

 【请求的 ip 】：135.119.38.56
 【 用  户 】 加了  12         个单词上限2025-10-06 18:39:15
######## 10/6/2025, 6:39:27 PM
tid=5bf464d091644fe7e68153e1c34d33e3

 【请求的 ip 】：132.196.32.67
 【 用  户 】 加了  12         个单词上限2025-10-06 18:49:20
######## 10/6/2025, 6:49:31 PM
tid=5bf464d091644fe7e68153e1c34d33e3

 【请求的 ip 】：64.236.133.198
 【 用  户 】 加了  12         个单词上限2025-10-06 19:13:48
######## 10/6/2025, 7:13:59 PM
tid=5bf464d091644fe7e68153e1c34d33e3

 【请求的 ip 】：20.161.70.165
 【 用  户 】 加了  12         个单词上限2025-10-06 19:28:23
######## 10/6/2025, 7:28:34 PM
tid=5bf464d091644fe7e68153e1c34d33e3

 【请求的 ip 】：172.215.210.227
 【 用  户 】 加了  12         个单词上限2025-10-06 19:44:22
######## 10/6/2025, 7:44:32 PM
tid=5bf464d091644fe7e68153e1c34d33e3

 【请求的 ip 】：64.236.200.229
 【 用  户 】 加了  12         个单词上限2025-10-06 20:34:06
######## 10/6/2025, 8:34:16 PM
tid=5bf464d091644fe7e68153e1c34d33e3

 【请求的 ip 】：64.236.134.35
 【 用  户 】 加了  12         个单词上限2025-10-06 21:07:57
######## 10/6/2025, 9:08:08 PM
tid=5bf464d091644fe7e68153e1c34d33e3

 【请求的 ip 】：68.154.38.18
 【 用  户 】 加了  12         个单词上限2025-10-06 21:40:54
######## 10/6/2025, 9:41:06 PM
tid=5bf464d091644fe7e68153e1c34d33e3

 【请求的 ip 】：172.182.226.130
 【 用  户 】 加了  12         个单词上限2025-10-06 22:16:21
######## 10/6/2025, 10:16:32 PM
tid=5bf464d091644fe7e68153e1c34d33e3

 【请求的 ip 】：172.174.221.228
 【 用  户 】 加了  12         个单词上限2025-10-06 22:36:48
######## 10/6/2025, 10:36:59 PM
tid=5bf464d091644fe7e68153e1c34d33e3

 【请求的 ip 】：52.161.50.41
 【 用  户 】 加了  12         个单词上限2025-10-06 22:48:55
######## 10/6/2025, 10:49:05 PM
tid=5bf464d091644fe7e68153e1c34d33e3

 【请求的 ip 】：172.215.231.151
 【 用  户 】 加了  12         个单词上限2025-10-06 23:16:29
######## 10/6/2025, 11:16:40 PM
tid=5bf464d091644fe7e68153e1c34d33e3

 【请求的 ip 】：172.178.117.212
 【 用  户 】 加了  12         个单词上限2025-10-06 23:32:55
######## 10/6/2025, 11:33:06 PM
tid=5bf464d091644fe7e68153e1c34d33e3

 【请求的 ip 】：52.161.51.149
 【 用  户 】 加了  12         个单词上限2025-10-06 23:45:22
######## 10/6/2025, 11:45:32 PM
tid=5bf464d091644fe7e68153e1c34d33e3

 【请求的 ip 】：4.246.135.3
 【 用  户 】 加了  12         个单词上限2025-10-07 00:20:08
######## 10/7/2025, 12:20:18 AM
tid=5bf464d091644fe7e68153e1c34d33e3

 【请求的 ip 】：172.184.191.166
 【 用  户 】 加了  12         个单词上限2025-10-07 00:41:46
######## 10/7/2025, 12:41:57 AM
tid=5bf464d091644fe7e68153e1c34d33e3

 【请求的 ip 】：74.249.78.165
 【 用  户 】 加了  12         个单词上限2025-10-07 01:14:46
######## 10/7/2025, 1:14:57 AM
tid=5bf464d091644fe7e68153e1c34d33e3

 【请求的 ip 】：172.184.175.148
 【 用  户 】 加了  12         个单词上限2025-10-07 01:31:29
######## 10/7/2025, 1:31:39 AM
tid=5bf464d091644fe7e68153e1c34d33e3

 【请求的 ip 】：135.232.200.4
 【 用  户 】 加了  12         个单词上限2025-10-07 01:44:10
######## 10/7/2025, 1:44:21 AM
tid=5bf464d091644fe7e68153e1c34d33e3

 【请求的 ip 】：4.236.151.0
 【 用  户 】 加了  12         个单词上限2025-10-07 02:23:52
######## 10/7/2025, 2:24:02 AM
tid=5bf464d091644fe7e68153e1c34d33e3

 【请求的 ip 】：40.65.56.227
 【 用  户 】 加了  12         个单词上限2025-10-07 02:51:07
######## 10/7/2025, 2:51:17 AM
tid=5bf464d091644fe7e68153e1c34d33e3

 【请求的 ip 】：64.236.153.147
 【 用  户 】 加了  12         个单词上限2025-10-07 03:12:55
######## 10/7/2025, 3:13:06 AM
tid=5bf464d091644fe7e68153e1c34d33e3

 【请求的 ip 】：20.51.198.197
 【 用  户 】 加了  12         个单词上限2025-10-07 03:26:54
######## 10/7/2025, 3:27:05 AM
tid=5bf464d091644fe7e68153e1c34d33e3

 【请求的 ip 】：172.182.195.88
 【 用  户 】 加了  12         个单词上限2025-10-07 03:44:13
######## 10/7/2025, 3:44:24 AM
tid=5bf464d091644fe7e68153e1c34d33e3

 【请求的 ip 】：172.172.87.195
 【 用  户 】 加了  12         个单词上限2025-10-07 04:17:33
######## 10/7/2025, 4:17:43 AM
tid=5bf464d091644fe7e68153e1c34d33e3

 【请求的 ip 】：20.161.30.226
 【 用  户 】 加了  12         个单词上限2025-10-07 04:34:43
######## 10/7/2025, 4:34:54 AM
tid=5bf464d091644fe7e68153e1c34d33e3

 【请求的 ip 】：172.212.171.147
 【 用  户 】 加了  12         个单词上限2025-10-07 04:45:56
######## 10/7/2025, 4:46:06 AM
tid=5bf464d091644fe7e68153e1c34d33e3

 【请求的 ip 】：172.183.157.178
 【 用  户 】 加了  12         个单词上限2025-10-07 05:13:41
######## 10/7/2025, 5:13:51 AM
tid=5bf464d091644fe7e68153e1c34d33e3

 【请求的 ip 】：172.215.209.241
 【 用  户 】 加了  12         个单词上限2025-10-07 05:28:41
######## 10/7/2025, 5:28:52 AM
tid=5bf464d091644fe7e68153e1c34d33e3

 【请求的 ip 】：20.109.38.52
 【 用  户 】 加了  12         个单词上限2025-10-07 05:44:08
######## 10/7/2025, 5:44:19 AM
tid=5bf464d091644fe7e68153e1c34d33e3

 【请求的 ip 】：20.81.159.118
 【 用  户 】 加了  12         个单词上限2025-10-07 06:14:23
######## 10/7/2025, 6:14:34 AM
tid=5bf464d091644fe7e68153e1c34d33e3

 【请求的 ip 】：172.184.174.116
 【 用  户 】 加了  12         个单词上限2025-10-07 06:31:55
######## 10/7/2025, 6:32:07 AM
tid=5bf464d091644fe7e68153e1c34d33e3

 【请求的 ip 】：68.154.117.37
 【 用  户 】 加了  12         个单词上限2025-10-07 06:44:44
######## 10/7/2025, 6:44:55 AM
tid=5bf464d091644fe7e68153e1c34d33e3

 【请求的 ip 】：20.81.159.2
 【 用  户 】 加了  12         个单词上限2025-10-07 07:14:40
######## 10/7/2025, 7:14:50 AM
tid=5bf464d091644fe7e68153e1c34d33e3

 【请求的 ip 】：135.232.224.165
 【 用  户 】 加了  12         个单词上限2025-10-07 07:29:20
######## 10/7/2025, 7:29:31 AM
tid=5bf464d091644fe7e68153e1c34d33e3

 【请求的 ip 】：52.165.58.33
 【 用  户 】 加了  12         个单词上限2025-10-07 07:44:20
######## 10/7/2025, 7:44:31 AM
tid=5bf464d091644fe7e68153e1c34d33e3

 【请求的 ip 】：20.161.70.177
 【 用  户 】 加了  12         个单词上限2025-10-07 09:12:29
######## 10/7/2025, 9:12:39 AM
tid=5bf464d091644fe7e68153e1c34d33e3

 【请求的 ip 】：52.159.247.70
 【 用  户 】 加了  12         个单词上限2025-10-07 10:37:09
######## 10/7/2025, 10:37:21 AM
tid=5bf464d091644fe7e68153e1c34d33e3

 【请求的 ip 】：52.154.21.48
 【 用  户 】 加了  12         个单词上限2025-10-07 11:19:51
######## 10/7/2025, 11:20:04 AM
tid=5bf464d091644fe7e68153e1c34d33e3

 【请求的 ip 】：135.232.216.55
 【 用  户 】 加了  12         个单词上限2025-10-07 11:43:48
######## 10/7/2025, 11:43:59 AM
tid=5bf464d091644fe7e68153e1c34d33e3

 【请求的 ip 】：172.212.169.152
 【 用  户 】 加了  12         个单词上限2025-10-07 12:19:28
######## 10/7/2025, 12:19:39 PM
tid=5bf464d091644fe7e68153e1c34d33e3

 【请求的 ip 】：57.151.136.169
 【 用  户 】 加了  12         个单词上限2025-10-07 12:38:31
######## 10/7/2025, 12:38:42 PM
tid=5bf464d091644fe7e68153e1c34d33e3

 【请求的 ip 】：68.154.116.113
 【 用  户 】 加了  12         个单词上限2025-10-07 12:48:23
######## 10/7/2025, 12:48:35 PM
tid=5bf464d091644fe7e68153e1c34d33e3

 【请求的 ip 】：64.236.135.7
 【 用  户 】 加了  12         个单词上限2025-10-07 13:15:42
######## 10/7/2025, 1:15:53 PM
tid=5bf464d091644fe7e68153e1c34d33e3

 【请求的 ip 】：172.215.211.50
 【 用  户 】 加了  12         个单词上限2025-10-07 13:33:05
######## 10/7/2025, 1:33:15 PM
tid=5bf464d091644fe7e68153e1c34d33e3

 【请求的 ip 】：20.171.127.102
 【 用  户 】 加了  12         个单词上限2025-10-07 13:44:04
######## 10/7/2025, 1:44:14 PM
tid=5bf464d091644fe7e68153e1c34d33e3

 【请求的 ip 】：172.215.216.233
 【 用  户 】 加了  12         个单词上限2025-10-07 14:24:23
######## 10/7/2025, 2:24:34 PM
tid=5bf464d091644fe7e68153e1c34d33e3

 【请求的 ip 】：104.209.7.209
 【 用  户 】 加了  12         个单词上限2025-10-07 14:52:04
######## 10/7/2025, 2:52:15 PM
tid=5bf464d091644fe7e68153e1c34d33e3

 【请求的 ip 】：172.184.213.248
 【 用  户 】 加了  12         个单词上限2025-10-07 15:16:04
######## 10/7/2025, 3:16:15 PM
tid=5bf464d091644fe7e68153e1c34d33e3

 【请求的 ip 】：172.190.93.136
 【 用  户 】 加了  12         个单词上限2025-10-07 15:30:53
######## 10/7/2025, 3:31:05 PM
tid=5bf464d091644fe7e68153e1c34d33e3

 【请求的 ip 】：64.236.177.3
 【 用  户 】 加了  12         个单词上限2025-10-07 15:43:58
######## 10/7/2025, 3:44:09 PM
tid=5bf464d091644fe7e68153e1c34d33e3

 【请求的 ip 】：20.161.71.48
 【 用  户 】 加了  12         个单词上限2025-10-07 16:21:53
######## 10/7/2025, 4:22:04 PM
tid=5bf464d091644fe7e68153e1c34d33e3

 【请求的 ip 】：20.171.125.216
 【 用  户 】 加了  12         个单词上限2025-10-07 16:50:34
######## 10/7/2025, 4:50:45 PM
tid=5bf464d091644fe7e68153e1c34d33e3

 【请求的 ip 】：48.214.55.50
 【 用  户 】 加了  12         个单词上限2025-10-07 17:17:43
######## 10/7/2025, 5:17:54 PM
tid=5bf464d091644fe7e68153e1c34d33e3

 【请求的 ip 】：172.208.153.9
 【 用  户 】 加了  12         个单词上限2025-10-07 17:34:33
######## 10/7/2025, 5:34:45 PM
tid=5bf464d091644fe7e68153e1c34d33e3

 【请求的 ip 】：172.178.117.213
 【 用  户 】 加了  12         个单词上限2025-10-07 17:46:25
######## 10/7/2025, 5:46:36 PM
tid=5bf464d091644fe7e68153e1c34d33e3

 【请求的 ip 】：128.24.162.4
 【 用  户 】 加了  12         个单词上限2025-10-07 18:17:10
######## 10/7/2025, 6:17:21 PM
tid=5bf464d091644fe7e68153e1c34d33e3

 【请求的 ip 】：104.209.7.232
 【 用  户 】 加了  12         个单词上限2025-10-07 18:37:55
######## 10/7/2025, 6:38:06 PM
tid=5bf464d091644fe7e68153e1c34d33e3

 【请求的 ip 】：52.161.74.202
 【 用  户 】 加了  12         个单词上限2025-10-07 18:48:43
######## 10/7/2025, 6:48:54 PM
tid=5bf464d091644fe7e68153e1c34d33e3

 【请求的 ip 】：52.159.245.183
 【 用  户 】 加了  12         个单词上限2025-10-07 19:13:40
######## 10/7/2025, 7:13:51 PM
tid=5bf464d091644fe7e68153e1c34d33e3

 【请求的 ip 】：64.236.176.150
 【 用  户 】 加了  12         个单词上限2025-10-07 19:27:56
######## 10/7/2025, 7:28:07 PM
tid=5bf464d091644fe7e68153e1c34d33e3

 【请求的 ip 】：64.236.201.16
 【 用  户 】 加了  12         个单词上限2025-10-07 19:44:45
######## 10/7/2025, 7:44:55 PM
tid=5bf464d091644fe7e68153e1c34d33e3

 【请求的 ip 】：20.102.47.200
 【 用  户 】 加了  12         个单词上限2025-10-07 20:34:25
######## 10/7/2025, 8:34:36 PM
tid=5bf464d091644fe7e68153e1c34d33e3

 【请求的 ip 】：20.171.125.210
 【 用  户 】 加了  15         个单词上限2025-10-07 21:08:37
######## 10/7/2025, 9:08:55 PM
tid=5bf464d091644fe7e68153e1c34d33e3

 【请求的 ip 】：68.220.61.193
 【 用  户 】 加了  15         个单词上限2025-10-07 21:41:38
######## 10/7/2025, 9:41:49 PM
tid=5bf464d091644fe7e68153e1c34d33e3

 【请求的 ip 】：40.116.73.182
 【 用  户 】 加了  15         个单词上限2025-10-07 22:17:06
######## 10/7/2025, 10:17:16 PM
tid=5bf464d091644fe7e68153e1c34d33e3

 【请求的 ip 】：52.190.182.119
 【 用  户 】 加了  15         个单词上限2025-10-07 22:39:27
######## 10/7/2025, 10:39:38 PM
tid=5bf464d091644fe7e68153e1c34d33e3

 【请求的 ip 】：172.214.45.243
 【 用  户 】 加了  15         个单词上限2025-10-07 22:51:44
######## 10/7/2025, 10:51:54 PM
tid=5bf464d091644fe7e68153e1c34d33e3

 【请求的 ip 】：20.51.198.213
 【 用  户 】 加了  15         个单词上限2025-10-07 23:17:53
######## 10/7/2025, 11:18:04 PM
tid=5bf464d091644fe7e68153e1c34d33e3

 【请求的 ip 】：52.225.29.101
 【 用  户 】 加了  15         个单词上限2025-10-07 23:36:24
######## 10/7/2025, 11:36:34 PM
tid=5bf464d091644fe7e68153e1c34d33e3

 【请求的 ip 】：20.161.28.102
 【 用  户 】 加了  15         个单词上限2025-10-07 23:48:00
######## 10/7/2025, 11:48:11 PM
tid=5bf464d091644fe7e68153e1c34d33e3

 【请求的 ip 】：172.215.210.56
 【 用  户 】 加了  15         个单词上限2025-10-08 00:19:57
######## 10/8/2025, 12:20:08 AM
tid=5bf464d091644fe7e68153e1c34d33e3

 【请求的 ip 】：135.232.200.210
 【 用  户 】 加了  15         个单词上限2025-10-08 00:42:08
######## 10/8/2025, 12:42:19 AM
tid=5bf464d091644fe7e68153e1c34d33e3

 【请求的 ip 】：20.42.42.215
 【 用  户 】 加了  15         个单词上限2025-10-08 01:14:07
######## 10/8/2025, 1:14:18 AM
tid=5bf464d091644fe7e68153e1c34d33e3

 【请求的 ip 】：48.214.54.114
 【 用  户 】 加了  15         个单词上限2025-10-08 01:32:18
######## 10/8/2025, 1:32:29 AM
tid=5bf464d091644fe7e68153e1c34d33e3

 【请求的 ip 】：135.232.177.243
 【 用  户 】 加了  15         个单词上限2025-10-08 01:44:56
######## 10/8/2025, 1:45:07 AM
tid=5bf464d091644fe7e68153e1c34d33e3

 【请求的 ip 】：64.236.192.150
 【 用  户 】 加了  15         个单词上限2025-10-08 02:25:31
######## 10/8/2025, 2:28:41 AM
tid=04d21b1fc5df6b4b372ce356d4592944

 【请求的 ip 】：135.232.224.100
 【 用  户 】 加了  15         个单词上限2025-10-08 12:44:35
######## 10/8/2025, 12:44:47 PM
tid=04d21b1fc5df6b4b372ce356d4592944

 【请求的 ip 】：64.236.201.51
 【 用  户 】 加了  15         个单词上限2025-10-08 14:50:37
######## 10/8/2025, 2:50:48 PM
tid=6d64495f37b562e57580debda161cd5a

 【请求的 ip 】：68.220.59.119
 【 用  户 】 加了  18         个单词上限2025-10-08 15:41:31
######## 10/8/2025, 3:41:42 PM
tid=6d64495f37b562e57580debda161cd5a

 【请求的 ip 】：172.174.165.228
 【 用  户 】 加了  18         个单词上限2025-10-08 17:43:30
######## 10/8/2025, 5:43:42 PM
tid=6d64495f37b562e57580debda161cd5a

 【请求的 ip 】：172.182.194.216
 【 用  户 】 加了  18         个单词上限2025-10-08 18:44:46
######## 10/8/2025, 6:44:57 PM
tid=6d64495f37b562e57580debda161cd5a

 【请求的 ip 】：172.172.87.84
 【 用  户 】 加了  18         个单词上限2025-10-09 12:44:52
######## 10/9/2025, 12:45:03 PM
tid=6d64495f37b562e57580debda161cd5a

 【请求的 ip 】：20.171.125.210
 【 用  户 】 加了  18         个单词上限2025-10-09 14:51:29
######## 10/9/2025, 2:51:40 PM
tid=6d64495f37b562e57580debda161cd5a

 【请求的 ip 】：52.161.50.33
 【 用  户 】 加了  18         个单词上限2025-10-09 15:41:04
######## 10/9/2025, 3:41:15 PM
tid=6d64495f37b562e57580debda161cd5a

 【请求的 ip 】：64.236.135.114
 【 用  户 】 加了  18         个单词上限2025-10-09 17:43:14
######## 10/9/2025, 5:43:26 PM
tid=6d64495f37b562e57580debda161cd5a

 【请求的 ip 】：20.81.183.87
 【 用  户 】 加了  18         个单词上限2025-10-09 18:45:46
######## 10/9/2025, 6:45:57 PM
tid=6d64495f37b562e57580debda161cd5a

 【请求的 ip 】：172.212.165.66
 【 用  户 】 加了  18         个单词上限2025-10-10 12:44:27
######## 10/10/2025, 12:44:38 PM
tid=971680e4f4c593c8f1e363f814289999

 【请求的 ip 】：64.236.192.150
 【 用  户 】 加了  21         个单词上限2025-10-10 14:51:23
######## 10/10/2025, 2:51:35 PM
tid=971680e4f4c593c8f1e363f814289999

 【请求的 ip 】：52.160.164.113
 【 用  户 】 加了  21         个单词上限2025-10-10 15:40:41
######## 10/10/2025, 3:40:52 PM
tid=971680e4f4c593c8f1e363f814289999

 【请求的 ip 】：135.232.201.229
 【 用  户 】 加了  21         个单词上限2025-10-10 17:43:25
######## 10/10/2025, 5:43:36 PM
tid=971680e4f4c593c8f1e363f814289999

 【请求的 ip 】：172.182.212.51
 【 用  户 】 加了  21         个单词上限2025-10-10 18:44:12
######## 10/10/2025, 6:44:23 PM
tid=fe14a036b393db5cd3721fa663efba08

 【请求的 ip 】：4.227.135.146
 【 用  户 】 加了  21         个单词上限2025-10-11 12:42:28
######## 10/11/2025, 12:42:38 PM
tid=fe14a036b393db5cd3721fa663efba08

 【请求的 ip 】：52.161.82.100
 【 用  户 】 加了  21         个单词上限2025-10-11 14:46:39
######## 10/11/2025, 2:46:50 PM
tid=fe14a036b393db5cd3721fa663efba08

 【请求的 ip 】：52.176.124.230
 【 用  户 】 加了  21         个单词上限2025-10-11 15:39:33
######## 10/11/2025, 3:39:44 PM
tid=fe14a036b393db5cd3721fa663efba08

 【请求的 ip 】：9.234.151.83
 【 用  户 】 加了  21         个单词上限2025-10-11 17:39:46
######## 10/11/2025, 5:39:57 PM
tid=fe14a036b393db5cd3721fa663efba08

 【请求的 ip 】：172.208.127.37
 【 用  户 】 加了  21         个单词上限2025-10-11 18:41:23
######## 10/11/2025, 6:41:34 PM
tid=fe14a036b393db5cd3721fa663efba08

 【请求的 ip 】：68.220.62.177
 【 用  户 】 加了  21         个单词上限2025-10-12 12:42:44
######## 10/12/2025, 12:42:55 PM
tid=1f1be6cd0d47b65d16449a00157a8e11

 【请求的 ip 】：74.235.151.1
 【 用  户 】 加了  24         个单词上限2025-10-12 14:46:47
######## 10/12/2025, 2:46:58 PM
tid=1f1be6cd0d47b65d16449a00157a8e11

 【请求的 ip 】：52.225.29.1
 【 用  户 】 加了  24         个单词上限2025-10-12 15:39:33
######## 10/12/2025, 3:39:44 PM
tid=1f1be6cd0d47b65d16449a00157a8e11

 【请求的 ip 】：64.236.134.52
 【 用  户 】 加了  24         个单词上限2025-10-12 17:40:05
######## 10/12/2025, 5:40:16 PM
tid=1f1be6cd0d47b65d16449a00157a8e11

 【请求的 ip 】：20.109.87.115
 【 用  户 】 加了  24         个单词上限2025-10-12 18:41:32
######## 10/12/2025, 6:41:43 PM
tid=1f1be6cd0d47b65d16449a00157a8e11

 【请求的 ip 】：172.203.38.240
 【 用  户 】 加了  24         个单词上限2025-10-13 12:45:13
######## 10/13/2025, 12:45:23 PM
tid=ab381da1a550b56bb87736745c50c4b1

 【请求的 ip 】：128.24.163.37
 【 用  户 】 加了  27         个单词上限2025-10-13 14:52:50
######## 10/13/2025, 2:53:01 PM
tid=ab381da1a550b56bb87736745c50c4b1

 【请求的 ip 】：52.154.131.98
 【 用  户 】 加了  27         个单词上限2025-10-13 15:42:13
######## 10/13/2025, 3:42:24 PM
tid=ab381da1a550b56bb87736745c50c4b1

 【请求的 ip 】：128.24.160.248
 【 用  户 】 加了  27         个单词上限2025-10-13 17:45:24
######## 10/13/2025, 5:45:35 PM
tid=ab381da1a550b56bb87736745c50c4b1

 【请求的 ip 】：172.212.169.148
 【 用  户 】 加了  27         个单词上限2025-10-13 18:46:17
######## 10/13/2025, 6:46:28 PM
tid=ab381da1a550b56bb87736745c50c4b1

 【请求的 ip 】：20.161.68.243
 【 用  户 】 加了  27         个单词上限2025-10-14 12:44:27
######## 10/14/2025, 12:44:38 PM
tid=79ff179ccf00468a9aeca794e1290264

 【请求的 ip 】：20.161.69.38
 【 用  户 】 加了  30         个单词上限2025-10-14 14:50:45
######## 10/14/2025, 2:50:56 PM
tid=79ff179ccf00468a9aeca794e1290264

 【请求的 ip 】：52.159.243.199
 【 用  户 】 加了  30         个单词上限2025-10-14 15:41:28
######## 10/14/2025, 3:41:40 PM
tid=79ff179ccf00468a9aeca794e1290264

 【请求的 ip 】：172.184.210.246
 【 用  户 】 加了  30         个单词上限2025-10-14 17:44:15
######## 10/14/2025, 5:44:26 PM
tid=79ff179ccf00468a9aeca794e1290264

 【请求的 ip 】：52.176.138.183
 【 用  户 】 加了  30         个单词上限2025-10-14 18:45:52
######## 10/14/2025, 6:46:04 PM
tid=79ff179ccf00468a9aeca794e1290264

 【请求的 ip 】：52.176.125.114
 【 用  户 】 加了  30         个单词上限2025-10-15 12:45:01
######## 10/15/2025, 12:45:12 PM
tid=553571b1948171e36818b36bce944692

 【请求的 ip 】：20.109.38.181
 【 用  户 】 加了  33         个单词上限2025-10-15 14:50:45
######## 10/15/2025, 2:50:56 PM
tid=553571b1948171e36818b36bce944692

 【请求的 ip 】：48.214.53.117
 【 用  户 】 加了  33         个单词上限2025-10-15 15:42:45
######## 10/15/2025, 3:42:56 PM
tid=cae3270d482ffa97c292b5b48fc85548

 【请求的 ip 】：172.184.211.86
 【 用  户 】 加了  34         个单词上限2025-10-15 17:44:23
######## 10/15/2025, 5:44:35 PM
tid=cae3270d482ffa97c292b5b48fc85548

 【请求的 ip 】：68.154.115.183
 【 用  户 】 加了  34         个单词上限2025-10-15 18:46:56
######## 10/15/2025, 6:47:17 PM
tid=cae3270d482ffa97c292b5b48fc85548

 【请求的 ip 】：20.55.223.217
 【 用  户 】 加了  34         个单词上限2025-10-16 12:44:34
######## 10/16/2025, 12:44:45 PM
tid=cae3270d482ffa97c292b5b48fc85548

 【请求的 ip 】：20.102.222.23
 【 用  户 】 加了  34         个单词上限2025-10-16 14:50:52
######## 10/16/2025, 2:51:05 PM
tid=cae3270d482ffa97c292b5b48fc85548

 【请求的 ip 】：40.76.191.164
 【 用  户 】 加了  34         个单词上限2025-10-16 15:41:55
######## 10/16/2025, 3:42:07 PM
tid=cae3270d482ffa97c292b5b48fc85548

 【请求的 ip 】：64.236.176.192
 【 用  户 】 加了  34         个单词上限2025-10-16 17:55:11
######## 10/16/2025, 5:55:22 PM
tid=cae3270d482ffa97c292b5b48fc85548

 【请求的 ip 】：132.196.19.25
 【 用  户 】 加了  34         个单词上限2025-10-16 18:45:52
######## 10/16/2025, 6:46:03 PM
tid=cae3270d482ffa97c292b5b48fc85548

 【请求的 ip 】：172.182.226.214
 【 用  户 】 加了  34         个单词上限2025-10-17 12:44:49
######## 10/17/2025, 12:44:59 PM
tid=c780b71ad32866ac495d3d659cb4542b

 【请求的 ip 】：52.159.245.163
 【 用  户 】 加了  37         个单词上限2025-10-17 14:50:22
######## 10/17/2025, 2:50:34 PM
tid=c780b71ad32866ac495d3d659cb4542b

 【请求的 ip 】：172.183.157.178
 【 用  户 】 加了  37         个单词上限2025-10-17 15:41:28
######## 10/17/2025, 3:41:39 PM
tid=c780b71ad32866ac495d3d659cb4542b

 【请求的 ip 】：145.132.102.181
 【 用  户 】 加了  37         个单词上限2025-10-17 17:43:08
######## 10/17/2025, 5:43:19 PM
tid=c780b71ad32866ac495d3d659cb4542b

 【请求的 ip 】：52.173.237.215
 【 用  户 】 加了  37         个单词上限2025-10-17 18:44:26
######## 10/17/2025, 6:44:37 PM
tid=c780b71ad32866ac495d3d659cb4542b

 【请求的 ip 】：64.236.134.167
 【 用  户 】 加了  37         个单词上限2025-10-18 12:42:55
######## 10/18/2025, 12:43:06 PM
tid=12f8b789ee1e063d93ac87f8df66e1b8

 【请求的 ip 】：172.182.213.67
 【 用  户 】 加了  39         个单词上限2025-10-18 14:47:15
######## 10/18/2025, 2:47:28 PM
tid=12f8b789ee1e063d93ac87f8df66e1b8

 【请求的 ip 】：13.83.166.243
 【 用  户 】 加了  39         个单词上限2025-10-18 15:39:46
######## 10/18/2025, 3:39:56 PM
tid=12f8b789ee1e063d93ac87f8df66e1b8

 【请求的 ip 】：20.55.87.49
 【 用  户 】 加了  39         个单词上限2025-10-18 17:40:15
######## 10/18/2025, 5:40:26 PM
tid=12f8b789ee1e063d93ac87f8df66e1b8

 【请求的 ip 】：20.161.70.180
 【 用  户 】 加了  39         个单词上限2025-10-18 18:42:33
######## 10/18/2025, 6:42:45 PM
tid=12f8b789ee1e063d93ac87f8df66e1b8

 【请求的 ip 】：172.215.210.52
 【 用  户 】 加了  39         个单词上限2025-10-19 12:45:09
######## 10/19/2025, 12:45:20 PM
tid=69d441266ab45c9e6aa18ecd96bdee93

 【请求的 ip 】：135.232.216.65
 【 用  户 】 加了  44         个单词上限2025-10-19 14:47:37
######## 10/19/2025, 2:47:48 PM
tid=69d441266ab45c9e6aa18ecd96bdee93

 【请求的 ip 】：20.55.87.179
 【 用  户 】 加了  44         个单词上限2025-10-19 15:39:41
######## 10/19/2025, 3:39:52 PM
tid=69d441266ab45c9e6aa18ecd96bdee93

 【请求的 ip 】：64.236.144.105
 【 用  户 】 加了  44         个单词上限2025-10-19 17:40:15
######## 10/19/2025, 5:40:27 PM
tid=69d441266ab45c9e6aa18ecd96bdee93

 【请求的 ip 】：57.151.128.216
 【 用  户 】 加了  44         个单词上限2025-10-19 18:42:14
######## 10/19/2025, 6:42:25 PM
tid=69d441266ab45c9e6aa18ecd96bdee93

 【请求的 ip 】：13.83.217.52
 【 用  户 】 加了  44         个单词上限2025-10-20 12:46:22
######## 10/20/2025, 12:46:32 PM
tid=62d83792a2026a28ef979c8def70e579

 【请求的 ip 】：52.161.82.82
 【 用  户 】 加了  47         个单词上限2025-10-20 14:52:04
######## 10/20/2025, 2:52:15 PM
tid=62d83792a2026a28ef979c8def70e579

 【请求的 ip 】：52.159.226.0
 【 用  户 】 加了  47         个单词上限2025-10-20 15:48:51
######## 10/20/2025, 3:49:01 PM
tid=62d83792a2026a28ef979c8def70e579

 【请求的 ip 】：52.161.74.196
 【 用  户 】 加了  47         个单词上限2025-10-20 17:51:09
######## 10/20/2025, 5:51:20 PM
tid=62d83792a2026a28ef979c8def70e579

 【请求的 ip 】：172.184.220.194
 【 用  户 】 加了  47         个单词上限2025-10-20 18:46:40
######## 10/20/2025, 6:46:50 PM
tid=62d83792a2026a28ef979c8def70e579

 【请求的 ip 】：20.236.100.6
 【 用  户 】 加了  47         个单词上限2025-10-21 12:45:00
######## 10/21/2025, 12:45:12 PM
tid=62d83792a2026a28ef979c8def70e579

 【请求的 ip 】：64.236.176.194
 【 用  户 】 加了  47         个单词上限2025-10-21 14:50:53
######## 10/21/2025, 2:51:03 PM
tid=62d83792a2026a28ef979c8def70e579

 【请求的 ip 】：20.161.60.96
 【 用  户 】 加了  47         个单词上限2025-10-21 15:42:06
######## 10/21/2025, 3:42:17 PM
tid=62d83792a2026a28ef979c8def70e579

 【请求的 ip 】：20.55.213.114
 【 用  户 】 加了  47         个单词上限2025-10-21 17:44:50
######## 10/21/2025, 5:45:01 PM
tid=62d83792a2026a28ef979c8def70e579

 【请求的 ip 】：135.232.224.165
 【 用  户 】 加了  47         个单词上限2025-10-21 18:45:55
######## 10/21/2025, 6:46:06 PM
tid=62d83792a2026a28ef979c8def70e579

 【请求的 ip 】：135.232.232.19
 【 用  户 】 加了  47         个单词上限2025-10-22 12:46:24
######## 10/22/2025, 12:46:35 PM
tid=bb363f971f758073ff3bd62c7e7fe159

 【请求的 ip 】：132.196.82.1
 【 用  户 】 加了  50         个单词上限2025-10-22 14:52:37
######## 10/22/2025, 2:52:48 PM
tid=bb363f971f758073ff3bd62c7e7fe159

 【请求的 ip 】：20.161.30.246
 【 用  户 】 加了  50         个单词上限2025-10-22 15:42:58
######## 10/22/2025, 3:43:09 PM
tid=bb363f971f758073ff3bd62c7e7fe159

 【请求的 ip 】：52.159.245.154
 【 用  户 】 加了  50         个单词上限2025-10-22 17:45:31
######## 10/22/2025, 5:45:42 PM
tid=bb363f971f758073ff3bd62c7e7fe159

 【请求的 ip 】：52.173.237.219
 【 用  户 】 加了  50         个单词上限2025-10-22 18:47:58
######## 10/22/2025, 6:48:09 PM
tid=bb363f971f758073ff3bd62c7e7fe159

 【请求的 ip 】：172.182.195.39
 【 用  户 】 加了  50         个单词上限2025-10-23 12:45:11
######## 10/23/2025, 12:45:22 PM
tid=2d51ebdf8acaa0b6871f75b088d2cde2

 【请求的 ip 】：13.83.161.18
 【 用  户 】 加了  53         个单词上限2025-10-23 14:51:41
######## 10/23/2025, 2:51:52 PM
tid=2d51ebdf8acaa0b6871f75b088d2cde2

 【请求的 ip 】：172.184.209.154
 【 用  户 】 加了  53         个单词上限2025-10-23 15:41:49
######## 10/23/2025, 3:42:02 PM
tid=2d51ebdf8acaa0b6871f75b088d2cde2

 【请求的 ip 】：74.235.151.5
 【 用  户 】 加了  53         个单词上限2025-10-23 17:44:24
######## 10/23/2025, 5:44:35 PM
tid=2d51ebdf8acaa0b6871f75b088d2cde2

 【请求的 ip 】：20.55.87.151
 【 用  户 】 加了  53         个单词上限2025-10-23 18:45:04
######## 10/23/2025, 6:45:15 PM
tid=a246d806fba2d410e9476b025285cce5

 【请求的 ip 】：52.159.247.49
 【 用  户 】 加了  56         个单词上限2025-10-24 12:44:35
######## 10/24/2025, 12:44:46 PM
tid=a246d806fba2d410e9476b025285cce5

 【请求的 ip 】：172.208.127.193
 【 用  户 】 加了  56         个单词上限2025-10-24 14:50:16
######## 10/24/2025, 2:50:26 PM
tid=a246d806fba2d410e9476b025285cce5

 【请求的 ip 】：20.168.111.67
 【 用  户 】 加了  56         个单词上限2025-10-24 15:41:10
######## 10/24/2025, 3:41:21 PM
tid=a246d806fba2d410e9476b025285cce5

 【请求的 ip 】：64.236.134.50
 【 用  户 】 加了  56         个单词上限2025-10-24 17:43:00
######## 10/24/2025, 5:43:12 PM
tid=a246d806fba2d410e9476b025285cce5

 【请求的 ip 】：52.225.25.53
 【 用  户 】 加了  56         个单词上限2025-10-24 18:46:30
######## 10/24/2025, 6:46:40 PM
tid=a246d806fba2d410e9476b025285cce5

 【请求的 ip 】：52.176.19.198
 【 用  户 】 加了  56         个单词上限2025-10-25 12:43:24
######## 10/25/2025, 12:43:35 PM
tid=a255164ee9fa80239f2358273c212c8d

 【请求的 ip 】：172.182.224.192
 【 用  户 】 加了  59         个单词上限2025-10-25 14:47:27
######## 10/25/2025, 2:47:38 PM
tid=d4301ecfa98866d9e31cecede892de1d

 【请求的 ip 】：172.208.152.210
 【 用  户 】 加了  60         个单词上限2025-10-25 15:39:46
######## 10/25/2025, 3:39:57 PM
tid=d4301ecfa98866d9e31cecede892de1d

 【请求的 ip 】：64.236.133.133
 【 用  户 】 加了  60         个单词上限2025-10-25 17:40:30
######## 10/25/2025, 5:40:41 PM
tid=d4301ecfa98866d9e31cecede892de1d

 【请求的 ip 】：20.169.50.38
 【 用  户 】 加了  60         个单词上限2025-10-25 18:42:04
######## 10/25/2025, 6:42:15 PM
tid=d4301ecfa98866d9e31cecede892de1d

 【请求的 ip 】：52.159.225.196
 【 用  户 】 加了  60         个单词上限2025-10-26 12:43:40
######## 10/26/2025, 12:43:53 PM
tid=d4301ecfa98866d9e31cecede892de1d

 【请求的 ip 】：48.211.210.113
 【 用  户 】 加了  60         个单词上限2025-10-26 14:48:48
######## 10/26/2025, 2:48:59 PM
tid=3b3579ee93ebc77ad751b7c0bf1dbbbf

 【请求的 ip 】：57.151.128.129
 【 用  户 】 加了  63         个单词上限2025-10-26 15:39:39
######## 10/26/2025, 3:39:50 PM
tid=3b3579ee93ebc77ad751b7c0bf1dbbbf

 【请求的 ip 】：68.220.58.146
 【 用  户 】 加了  63         个单词上限2025-10-26 17:40:39
######## 10/26/2025, 5:40:51 PM
tid=3b3579ee93ebc77ad751b7c0bf1dbbbf

 【请求的 ip 】：20.171.127.101
 【 用  户 】 加了  63         个单词上限2025-10-26 18:42:33
######## 10/26/2025, 6:42:44 PM
tid=3b3579ee93ebc77ad751b7c0bf1dbbbf

 【请求的 ip 】：74.235.126.84
 【 用  户 】 加了  63         个单词上限2025-10-27 12:50:47
######## 10/27/2025, 12:50:58 PM
tid=3b3579ee93ebc77ad751b7c0bf1dbbbf

 【请求的 ip 】：172.182.224.115
 【 用  户 】 加了  63         个单词上限2025-10-27 14:55:19
######## 10/27/2025, 2:55:30 PM
tid=3b3579ee93ebc77ad751b7c0bf1dbbbf

 【请求的 ip 】：135.232.200.193
 【 用  户 】 加了  63         个单词上限2025-10-27 15:42:02
######## 10/27/2025, 3:42:13 PM
tid=3b3579ee93ebc77ad751b7c0bf1dbbbf

 【请求的 ip 】：4.227.174.184
 【 用  户 】 加了  63         个单词上限2025-10-27 17:45:51
######## 10/27/2025, 5:46:03 PM
tid=3b3579ee93ebc77ad751b7c0bf1dbbbf

 【请求的 ip 】：64.236.140.194
 【 用  户 】 加了  63         个单词上限2025-10-27 18:47:31
######## 10/27/2025, 6:47:42 PM
tid=3b3579ee93ebc77ad751b7c0bf1dbbbf

 【请求的 ip 】：40.76.238.178
 【 用  户 】 加了  63         个单词上限2025-10-28 12:46:09
######## 10/28/2025, 12:46:20 PM
tid=05719667858028ff813013a40f1833f5

 【请求的 ip 】：20.169.72.23
 【 用  户 】 加了  66         个单词上限2025-10-28 14:53:21
######## 10/28/2025, 2:53:32 PM
tid=05719667858028ff813013a40f1833f5

 【请求的 ip 】：172.184.210.53
 【 用  户 】 加了  66         个单词上限2025-10-28 15:42:17
######## 10/28/2025, 3:42:27 PM
tid=05719667858028ff813013a40f1833f5

 【请求的 ip 】：20.168.107.209
 【 用  户 】 加了  66         个单词上限2025-10-28 17:44:13
######## 10/28/2025, 5:44:24 PM
tid=05719667858028ff813013a40f1833f5

 【请求的 ip 】：52.161.50.39
 【 用  户 】 加了  66         个单词上限2025-10-28 18:47:27
######## 10/28/2025, 6:47:37 PM
tid=05719667858028ff813013a40f1833f5

 【请求的 ip 】：172.183.131.24
 【 用  户 】 加了  66         个单词上限2025-10-29 12:48:46
######## 10/29/2025, 12:48:56 PM
tid=6d70a089649e50bf5d0ceceafd1b74bb

 【请求的 ip 】：4.246.135.35
 【 用  户 】 加了  69         个单词上限2025-10-29 14:53:31
######## 10/29/2025, 2:53:41 PM
tid=6d70a089649e50bf5d0ceceafd1b74bb

 【请求的 ip 】：104.209.7.218
 【 用  户 】 加了  69         个单词上限2025-10-29 15:42:46
######## 10/29/2025, 3:42:57 PM
tid=6d70a089649e50bf5d0ceceafd1b74bb

 【请求的 ip 】：52.176.35.119
 【 用  户 】 加了  69         个单词上限2025-10-29 17:43:52
######## 10/29/2025, 5:44:03 PM
tid=58e8eae70ee7792d24384c02ecfbc9d6

 【请求的 ip 】：135.232.224.82
 【 用  户 】 加了  72         个单词上限2025-10-29 18:47:16
######## 10/29/2025, 6:47:27 PM
tid=58e8eae70ee7792d24384c02ecfbc9d6

 【请求的 ip 】：20.102.223.130
 【 用  户 】 加了  72         个单词上限2025-10-30 12:45:12
######## 10/30/2025, 12:45:23 PM
tid=58e8eae70ee7792d24384c02ecfbc9d6

 【请求的 ip 】：172.184.219.211
 【 用  户 】 加了  72         个单词上限2025-10-30 14:51:24
######## 10/30/2025, 2:51:35 PM
tid=58e8eae70ee7792d24384c02ecfbc9d6

 【请求的 ip 】：20.109.38.243
 【 用  户 】 加了  72         个单词上限2025-10-30 15:41:30
######## 10/30/2025, 3:41:41 PM
tid=58e8eae70ee7792d24384c02ecfbc9d6

 【请求的 ip 】：48.214.55.56
 【 用  户 】 加了  72         个单词上限2025-10-30 17:44:42
######## 10/30/2025, 5:44:53 PM
tid=58e8eae70ee7792d24384c02ecfbc9d6

 【请求的 ip 】：51.8.121.160
 【 用  户 】 加了  72         个单词上限2025-10-30 18:46:39
######## 10/30/2025, 6:46:50 PM
tid=58e8eae70ee7792d24384c02ecfbc9d6

 【请求的 ip 】：52.173.178.212
 【 用  户 】 加了  72         个单词上限2025-10-31 12:47:04
######## 10/31/2025, 12:47:15 PM
tid=55ba27492e235b699fc0c5676875fbb6

 【请求的 ip 】：52.190.140.132
 【 用  户 】 加了  74         个单词上限2025-10-31 14:52:09
######## 10/31/2025, 2:52:20 PM
tid=55ba27492e235b699fc0c5676875fbb6

 【请求的 ip 】：52.238.24.33
 【 用  户 】 加了  77         个单词上限2025-10-31 15:41:23
######## 10/31/2025, 3:41:34 PM
tid=55ba27492e235b699fc0c5676875fbb6

 【请求的 ip 】：4.227.135.145
 【 用  户 】 加了  77         个单词上限2025-10-31 17:43:51
######## 10/31/2025, 5:44:02 PM
tid=55ba27492e235b699fc0c5676875fbb6

 【请求的 ip 】：64.236.141.178
 【 用  户 】 加了  77         个单词上限2025-10-31 18:45:43
######## 10/31/2025, 6:45:54 PM
tid=55ba27492e235b699fc0c5676875fbb6

 【请求的 ip 】：52.238.26.244
 【 用  户 】 加了  77         个单词上限2025-11-01 12:43:29
######## 11/1/2025, 12:43:41 PM
tid=55ba27492e235b699fc0c5676875fbb6

 【请求的 ip 】：172.183.94.240
 【 用  户 】 加了  77         个单词上限2025-11-01 14:47:40
######## 11/1/2025, 2:47:51 PM
tid=bda6e90b41538a9bafb5d6762555555c

 【请求的 ip 】：52.159.229.144
 【 用  户 】 加了  80         个单词上限2025-11-01 15:39:39
######## 11/1/2025, 3:39:50 PM
tid=bda6e90b41538a9bafb5d6762555555c

 【请求的 ip 】：172.184.219.80
 【 用  户 】 加了  80         个单词上限2025-11-01 17:40:35
######## 11/1/2025, 5:40:46 PM
tid=bda6e90b41538a9bafb5d6762555555c

 【请求的 ip 】：20.161.70.160
 【 用  户 】 加了  80         个单词上限2025-11-01 18:42:13
######## 11/1/2025, 6:42:24 PM
tid=bda6e90b41538a9bafb5d6762555555c

 【请求的 ip 】：172.184.211.160
 【 用  户 】 加了  80         个单词上限2025-11-02 12:45:17
######## 11/2/2025, 12:45:28 PM
tid=bda6e90b41538a9bafb5d6762555555c

 【请求的 ip 】：20.236.100.0
 【 用  户 】 加了  80         个单词上限2025-11-02 14:49:25
######## 11/2/2025, 2:49:36 PM
tid=bda6e90b41538a9bafb5d6762555555c

 【请求的 ip 】：145.132.103.176
 【 用  户 】 加了  80         个单词上限2025-11-02 15:39:52
######## 11/2/2025, 3:40:03 PM
tid=bda6e90b41538a9bafb5d6762555555c

 【请求的 ip 】：172.184.211.34
 【 用  户 】 加了  80         个单词上限2025-11-02 17:40:05
######## 11/2/2025, 5:40:17 PM
tid=2d7d710c3096c4f51530f84900b9a149

 【请求的 ip 】：4.246.135.68
 【 用  户 】 加了  83         个单词上限2025-11-02 18:42:18
######## 11/2/2025, 6:42:29 PM
tid=2d7d710c3096c4f51530f84900b9a149

 【请求的 ip 】：20.168.109.193
 【 用  户 】 加了  83         个单词上限2025-11-03 12:50:09
######## 11/3/2025, 12:50:20 PM
tid=2d7d710c3096c4f51530f84900b9a149

 【请求的 ip 】：64.236.200.81
 【 用  户 】 加了  83         个单词上限2025-11-03 14:53:31
######## 11/3/2025, 2:53:42 PM
tid=2d7d710c3096c4f51530f84900b9a149

 【请求的 ip 】：128.24.160.229
 【 用  户 】 加了  83         个单词上限2025-11-03 15:42:25
######## 11/3/2025, 3:42:36 PM
tid=2d7d710c3096c4f51530f84900b9a149

 【请求的 ip 】：52.161.50.38
 【 用  户 】 加了  83         个单词上限2025-11-03 17:47:08
######## 11/3/2025, 5:47:19 PM
tid=264b6035db91fe80f4ef12ee6d5ab67e

 【请求的 ip 】：52.161.51.145
 【 用  户 】 加了  86         个单词上限2025-11-03 18:48:23
######## 11/3/2025, 6:48:33 PM
tid=264b6035db91fe80f4ef12ee6d5ab67e

 【请求的 ip 】：172.182.202.193
 【 用  户 】 加了  86         个单词上限2025-11-04 12:45:32
######## 11/4/2025, 12:45:43 PM
tid=264b6035db91fe80f4ef12ee6d5ab67e

 【请求的 ip 】：52.165.251.162
 【 用  户 】 加了  86         个单词上限2025-11-04 14:53:25
######## 11/4/2025, 2:53:36 PM
tid=264b6035db91fe80f4ef12ee6d5ab67e

 【请求的 ip 】：64.236.142.129
 【 用  户 】 加了  86         个单词上限2025-11-04 15:42:17
######## 11/4/2025, 3:42:28 PM
tid=264b6035db91fe80f4ef12ee6d5ab67e

 【请求的 ip 】：20.51.198.208
 【 用  户 】 加了  86         个单词上限2025-11-04 17:46:05
######## 11/4/2025, 5:46:16 PM
tid=264b6035db91fe80f4ef12ee6d5ab67e

 【请求的 ip 】：52.190.183.81
 【 用  户 】 加了  86         个单词上限2025-11-04 18:49:27
######## 11/4/2025, 6:49:38 PM
tid=264b6035db91fe80f4ef12ee6d5ab67e

 【请求的 ip 】：172.171.254.152
 【 用  户 】 加了  86         个单词上限2025-11-05 12:46:10
######## 11/5/2025, 12:46:21 PM
tid=f7b2505bbe5e2342e0576598cdeed55a

 【请求的 ip 】：172.215.217.97
 【 用  户 】 加了  89         个单词上限2025-11-05 14:52:47
######## 11/5/2025, 2:52:58 PM
tid=f7b2505bbe5e2342e0576598cdeed55a

 【请求的 ip 】：64.236.153.148
 【 用  户 】 加了  89         个单词上限2025-11-05 15:42:59
######## 11/5/2025, 3:43:09 PM
tid=f7b2505bbe5e2342e0576598cdeed55a

 【请求的 ip 】：172.184.210.214
 【 用  户 】 加了  89         个单词上限2025-11-05 17:46:21
######## 11/5/2025, 5:46:32 PM
tid=f7b2505bbe5e2342e0576598cdeed55a

 【请求的 ip 】：135.232.208.180
 【 用  户 】 加了  89         个单词上限2025-11-05 18:47:39
######## 11/5/2025, 6:47:50 PM
tid=f7b2505bbe5e2342e0576598cdeed55a

 【请求的 ip 】：52.234.43.178
 【 用  户 】 加了  89         个单词上限2025-11-06 12:48:57
######## 11/6/2025, 12:49:09 PM
tid=13d3a40c1ed2138478d3c0fbc16c945e

 【请求的 ip 】：52.225.29.100
 【 用  户 】 加了  92         个单词上限2025-11-06 14:53:17
######## 11/6/2025, 2:53:27 PM
tid=13d3a40c1ed2138478d3c0fbc16c945e

 【请求的 ip 】：172.178.119.19
 【 用  户 】 加了  92         个单词上限2025-11-06 15:41:48
######## 11/6/2025, 3:41:59 PM
tid=13d3a40c1ed2138478d3c0fbc16c945e

 【请求的 ip 】：52.173.178.214
 【 用  户 】 加了  92         个单词上限2025-11-06 17:45:00
######## 11/6/2025, 5:45:11 PM
tid=13d3a40c1ed2138478d3c0fbc16c945e

 【请求的 ip 】：52.159.243.23
 【 用  户 】 加了  92         个单词上限2025-11-06 18:47:52
######## 11/6/2025, 6:48:04 PM
tid=13d3a40c1ed2138478d3c0fbc16c945e

 【请求的 ip 】：68.220.60.224
 【 用  户 】 加了  92         个单词上限2025-11-07 12:45:28
######## 11/7/2025, 12:45:39 PM
tid=1398615c9375ae11fa07da0a71639552

 【请求的 ip 】：172.214.47.49
 【 用  户 】 加了  95         个单词上限2025-11-07 14:52:25
######## 11/7/2025, 2:52:36 PM
tid=1398615c9375ae11fa07da0a71639552

 【请求的 ip 】：172.178.117.209
 【 用  户 】 加了  95         个单词上限2025-11-07 15:42:15
######## 11/7/2025, 3:42:27 PM
tid=1398615c9375ae11fa07da0a71639552

 【请求的 ip 】：172.172.86.227
 【 用  户 】 加了  95         个单词上限2025-11-07 17:43:33
######## 11/7/2025, 5:43:44 PM
tid=1398615c9375ae11fa07da0a71639552

 【请求的 ip 】：172.183.89.131
 【 用  户 】 加了  95         个单词上限2025-11-07 18:46:12
######## 11/7/2025, 6:46:23 PM
tid=1398615c9375ae11fa07da0a71639552

 【请求的 ip 】：64.236.153.148
 【 用  户 】 加了  95         个单词上限2025-11-08 12:44:20
######## 11/8/2025, 12:44:32 PM
tid=1398615c9375ae11fa07da0a71639552

 【请求的 ip 】：52.161.74.197
 【 用  户 】 加了  95         个单词上限2025-11-08 14:48:43
######## 11/8/2025, 2:48:53 PM
tid=1398615c9375ae11fa07da0a71639552

 【请求的 ip 】：172.182.226.20
 【 用  户 】 加了  95         个单词上限2025-11-08 15:39:50
######## 11/8/2025, 3:40:01 PM
tid=1398615c9375ae11fa07da0a71639552

 【请求的 ip 】：64.236.135.2
 【 用  户 】 加了  95         个单词上限2025-11-08 17:40:55
######## 11/8/2025, 5:41:07 PM
tid=1398615c9375ae11fa07da0a71639552

 【请求的 ip 】：172.182.226.64
 【 用  户 】 加了  95         个单词上限2025-11-08 18:42:17
######## 11/8/2025, 6:42:28 PM
tid=1398615c9375ae11fa07da0a71639552

 【请求的 ip 】：172.178.117.209
 【 用  户 】 加了  95         个单词上限2025-11-09 12:44:45
######## 11/9/2025, 12:44:56 PM
tid=c688e14aeebfd294e2a8136fcdf3f13d

 【请求的 ip 】：172.172.153.36
 【 用  户 】 加了  98         个单词上限2025-11-09 14:49:02
######## 11/9/2025, 2:49:13 PM
tid=c688e14aeebfd294e2a8136fcdf3f13d

 【请求的 ip 】：135.232.177.193
 【 用  户 】 加了  98         个单词上限2025-11-09 15:39:49
######## 11/9/2025, 3:40:00 PM
tid=c688e14aeebfd294e2a8136fcdf3f13d

 【请求的 ip 】：52.154.21.51
 【 用  户 】 加了  98         个单词上限2025-11-09 17:41:11
######## 11/9/2025, 5:41:22 PM
tid=c688e14aeebfd294e2a8136fcdf3f13d

 【请求的 ip 】：4.236.158.84
 【 用  户 】 加了  98         个单词上限2025-11-09 18:42:31
######## 11/9/2025, 6:42:42 PM
tid=c688e14aeebfd294e2a8136fcdf3f13d

 【请求的 ip 】：172.182.202.192
 【 用  户 】 加了  98         个单词上限2025-11-10 12:48:40
######## 11/10/2025, 12:48:50 PM
tid=cd50b89b31ca71e697b4699d4b9780f9

 【请求的 ip 】：64.236.193.24
 【 用  户 】 加了  101         个单词上限2025-11-10 14:53:49
######## 11/10/2025, 2:54:00 PM
tid=cd50b89b31ca71e697b4699d4b9780f9

 【请求的 ip 】：48.214.54.97
 【 用  户 】 加了  101         个单词上限2025-11-10 15:42:09
######## 11/10/2025, 3:42:21 PM
tid=cd50b89b31ca71e697b4699d4b9780f9

 【请求的 ip 】：104.209.11.17
 【 用  户 】 加了  101         个单词上限2025-11-10 17:46:39
######## 11/10/2025, 5:46:50 PM
tid=cd50b89b31ca71e697b4699d4b9780f9

 【请求的 ip 】：52.161.59.145
 【 用  户 】 加了  101         个单词上限2025-11-10 18:47:47
######## 11/10/2025, 6:47:59 PM
tid=168ed404ea7edd133b6f1b52c97dfd98

 【请求的 ip 】：135.232.216.52
 【 用  户 】 加了  104         个单词上限2025-11-11 12:47:20
######## 11/11/2025, 12:47:31 PM
tid=168ed404ea7edd133b6f1b52c97dfd98

 【请求的 ip 】：172.182.213.0
 【 用  户 】 加了  104         个单词上限2025-11-11 14:53:24
######## 11/11/2025, 2:53:35 PM
tid=168ed404ea7edd133b6f1b52c97dfd98

 【请求的 ip 】：64.236.153.80
 【 用  户 】 加了  104         个单词上限2025-11-11 15:43:02
######## 11/11/2025, 3:43:12 PM
tid=168ed404ea7edd133b6f1b52c97dfd98

 【请求的 ip 】：52.173.219.146
 【 用  户 】 加了  104         个单词上限2025-11-11 17:44:54
######## 11/11/2025, 5:45:04 PM
tid=a2564eb67e6a16f32f68ffe308bdeb0e

 【请求的 ip 】：135.119.236.55
 【 用  户 】 加了  107         个单词上限2025-11-11 18:47:52
######## 11/11/2025, 6:48:03 PM
tid=a2564eb67e6a16f32f68ffe308bdeb0e

 【请求的 ip 】：52.165.251.162
 【 用  户 】 加了  107         个单词上限2025-11-12 12:47:21
######## 11/12/2025, 12:47:32 PM
tid=a2564eb67e6a16f32f68ffe308bdeb0e

 【请求的 ip 】：52.159.247.162
 【 用  户 】 加了  107         个单词上限2025-11-12 14:53:23
######## 11/12/2025, 2:53:33 PM
tid=20de01d6ce42e2504f49366331155b31

 【请求的 ip 】：68.220.59.242
 【 用  户 】 加了  110         个单词上限2025-11-12 15:43:08
######## 11/12/2025, 3:43:19 PM
tid=20de01d6ce42e2504f49366331155b31

 【请求的 ip 】：20.161.47.113
 【 用  户 】 加了  110         个单词上限2025-11-12 17:44:48
######## 11/12/2025, 5:44:59 PM
tid=20de01d6ce42e2504f49366331155b31

 【请求的 ip 】：13.83.233.98
 【 用  户 】 加了  110         个单词上限2025-11-12 18:49:07
######## 11/12/2025, 6:49:19 PM
tid=20de01d6ce42e2504f49366331155b31

 【请求的 ip 】：57.151.128.134
 【 用  户 】 加了  110         个单词上限2025-11-13 12:47:25
######## 11/13/2025, 12:47:36 PM
tid=20de01d6ce42e2504f49366331155b31

 【请求的 ip 】：57.151.129.52
 【 用  户 】 加了  110         个单词上限2025-11-13 14:53:09
######## 11/13/2025, 2:53:20 PM
tid=20de01d6ce42e2504f49366331155b31

 【请求的 ip 】：20.109.92.212
 【 用  户 】 加了  110         个单词上限2025-11-13 15:42:39
######## 11/13/2025, 3:42:50 PM
tid=410feb65ab88694b37b9da5158cbe7a0

 【请求的 ip 】：74.249.79.53
 【 用  户 】 加了  113         个单词上限2025-11-13 17:45:23
######## 11/13/2025, 5:45:34 PM
tid=410feb65ab88694b37b9da5158cbe7a0

 【请求的 ip 】：20.161.30.193
 【 用  户 】 加了  113         个单词上限2025-11-13 18:48:48
######## 11/13/2025, 6:48:59 PM
tid=410feb65ab88694b37b9da5158cbe7a0

 【请求的 ip 】：135.232.177.120
 【 用  户 】 加了  113         个单词上限2025-11-14 12:46:23
######## 11/14/2025, 12:46:34 PM
tid=410feb65ab88694b37b9da5158cbe7a0

 【请求的 ip 】：145.132.100.80
 【 用  户 】 加了  113         个单词上限2025-11-14 14:53:04
######## 11/14/2025, 2:53:15 PM
tid=410feb65ab88694b37b9da5158cbe7a0

 【请求的 ip 】：40.76.191.161
 【 用  户 】 加了  113         个单词上限2025-11-14 15:42:25
######## 11/14/2025, 3:42:36 PM
tid=56e9a9bdeb5f41479f4648f89efaad92

 【请求的 ip 】：172.212.171.147
 【 用  户 】 加了  116         个单词上限2025-11-14 17:44:51
######## 11/14/2025, 5:45:02 PM
tid=56e9a9bdeb5f41479f4648f89efaad92

 【请求的 ip 】：135.232.201.81
 【 用  户 】 加了  116         个单词上限2025-11-14 18:46:30
######## 11/14/2025, 6:46:41 PM
tid=56e9a9bdeb5f41479f4648f89efaad92

 【请求的 ip 】：20.51.198.192
 【 用  户 】 加了  116         个单词上限2025-11-15 12:44:45
######## 11/15/2025, 12:44:55 PM
tid=56e9a9bdeb5f41479f4648f89efaad92

 【请求的 ip 】：64.236.169.129
 【 用  户 】 加了  116         个单词上限2025-11-15 14:48:42
######## 11/15/2025, 2:48:53 PM
tid=56e9a9bdeb5f41479f4648f89efaad92

 【请求的 ip 】：172.214.45.201
 【 用  户 】 加了  116         个单词上限2025-11-15 15:39:37
######## 11/15/2025, 3:39:47 PM
tid=56e9a9bdeb5f41479f4648f89efaad92

 【请求的 ip 】：40.76.239.100
 【 用  户 】 加了  116         个单词上限2025-11-15 17:40:55
######## 11/15/2025, 5:41:06 PM
tid=56e9a9bdeb5f41479f4648f89efaad92

 【请求的 ip 】：20.161.44.226
 【 用  户 】 加了  116         个单词上限2025-11-15 18:42:49
######## 11/15/2025, 6:43:00 PM
tid=56e9a9bdeb5f41479f4648f89efaad92

 【请求的 ip 】：20.161.77.161
 【 用  户 】 加了  116         个单词上限2025-11-16 12:46:44
######## 11/16/2025, 12:46:55 PM
tid=97fa3a0f0d9577cf638914540f927baf

 【请求的 ip 】：20.55.15.225
 【 用  户 】 加了  119         个单词上限2025-11-16 14:50:01
######## 11/16/2025, 2:50:12 PM
tid=97fa3a0f0d9577cf638914540f927baf

 【请求的 ip 】：57.151.137.210
 【 用  户 】 加了  119         个单词上限2025-11-16 15:40:08
######## 11/16/2025, 3:40:19 PM
tid=97fa3a0f0d9577cf638914540f927baf

 【请求的 ip 】：172.183.94.240
 【 用  户 】 加了  119         个单词上限2025-11-16 17:41:46
######## 11/16/2025, 5:41:57 PM
tid=97fa3a0f0d9577cf638914540f927baf

 【请求的 ip 】：52.154.132.160
 【 用  户 】 加了  119         个单词上限2025-11-16 18:42:58
######## 11/16/2025, 6:43:09 PM
tid=97fa3a0f0d9577cf638914540f927baf

 【请求的 ip 】：172.214.47.51
 【 用  户 】 加了  119         个单词上限2025-11-17 12:48:11
######## 11/17/2025, 12:48:23 PM
tid=87535f050c7153a265ac0952903e00fc

 【请求的 ip 】：52.173.108.19
 【 用  户 】 加了  122         个单词上限2025-11-17 14:53:18
######## 11/17/2025, 2:53:29 PM
tid=87535f050c7153a265ac0952903e00fc

 【请求的 ip 】：52.160.164.122
 【 用  户 】 加了  122         个单词上限2025-11-17 15:42:26
######## 11/17/2025, 3:42:37 PM
tid=87535f050c7153a265ac0952903e00fc

 【请求的 ip 】：20.109.87.115
 【 用  户 】 加了  122         个单词上限2025-11-17 17:47:04
######## 11/17/2025, 5:47:14 PM
tid=87535f050c7153a265ac0952903e00fc

 【请求的 ip 】：20.171.126.213
 【 用  户 】 加了  122         个单词上限2025-11-17 18:48:31
######## 11/17/2025, 6:48:42 PM
tid=87535f050c7153a265ac0952903e00fc

 【请求的 ip 】：57.151.136.177
 【 用  户 】 加了  122         个单词上限2025-11-18 12:46:36
######## 11/18/2025, 12:46:47 PM
tid=83ad453012ca85ea6e0a48b370fd3aa3

 【请求的 ip 】：135.232.201.80
 【 用  户 】 加了  125         个单词上限2025-11-18 14:52:20
######## 11/18/2025, 2:52:31 PM
tid=83ad453012ca85ea6e0a48b370fd3aa3

 【请求的 ip 】：52.173.163.128
 【 用  户 】 加了  125         个单词上限2025-11-18 15:42:18
######## 11/18/2025, 3:42:31 PM
tid=83ad453012ca85ea6e0a48b370fd3aa3

 【请求的 ip 】：172.184.211.83
 【 用  户 】 加了  125         个单词上限2025-11-18 17:45:31
######## 11/18/2025, 5:45:43 PM
tid=83ad453012ca85ea6e0a48b370fd3aa3

 【请求的 ip 】：74.235.123.4
 【 用  户 】 加了  125         个单词上限2025-11-18 18:48:32
######## 11/18/2025, 6:48:42 PM
tid=83ad453012ca85ea6e0a48b370fd3aa3

 【请求的 ip 】：52.159.247.200
 【 用  户 】 加了  125         个单词上限2025-11-19 12:46:51
######## 11/19/2025, 12:47:03 PM
tid=bc73b9333f92d9908240b851dc66de43

 【请求的 ip 】：64.236.160.197
 【 用  户 】 加了  128         个单词上限2025-11-19 14:52:20
######## 11/19/2025, 2:52:31 PM
tid=bc73b9333f92d9908240b851dc66de43

 【请求的 ip 】：104.209.12.69
 【 用  户 】 加了  128         个单词上限2025-11-19 15:43:17
######## 11/19/2025, 3:43:28 PM
tid=bc73b9333f92d9908240b851dc66de43

 【请求的 ip 】：135.232.193.35
 【 用  户 】 加了  128         个单词上限2025-11-19 17:45:01
######## 11/19/2025, 5:45:12 PM
tid=bc73b9333f92d9908240b851dc66de43

 【请求的 ip 】：52.159.247.51
 【 用  户 】 加了  128         个单词上限2025-11-19 18:47:23
######## 11/19/2025, 6:47:34 PM
tid=bc73b9333f92d9908240b851dc66de43

 【请求的 ip 】：172.178.119.115
 【 用  户 】 加了  128         个单词上限2025-11-20 12:45:59
######## 11/20/2025, 12:46:10 PM
tid=af9d78f239282da81bbd28d54f333a83

 【请求的 ip 】：52.159.247.74
 【 用  户 】 加了  131         个单词上限2025-11-20 14:51:59
######## 11/20/2025, 2:52:10 PM
tid=af9d78f239282da81bbd28d54f333a83

 【请求的 ip 】：172.183.134.178
 【 用  户 】 加了  131         个单词上限2025-11-20 15:41:47
######## 11/20/2025, 3:41:57 PM
tid=af9d78f239282da81bbd28d54f333a83

 【请求的 ip 】：13.83.161.18
 【 用  户 】 加了  131         个单词上限2025-11-20 17:43:59
######## 11/20/2025, 5:44:09 PM
tid=af9d78f239282da81bbd28d54f333a83

 【请求的 ip 】：135.232.177.250
 【 用  户 】 加了  133         个单词上限2025-11-20 18:46:56
######## 11/20/2025, 6:47:07 PM
tid=af9d78f239282da81bbd28d54f333a83

 【请求的 ip 】：52.161.45.225
 【 用  户 】 加了  133         个单词上限2025-11-21 12:46:32
######## 11/21/2025, 12:46:43 PM
tid=af9d78f239282da81bbd28d54f333a83

 【请求的 ip 】：52.238.26.242
 【 用  户 】 加了  133         个单词上限2025-11-21 14:54:00
######## 11/21/2025, 2:54:11 PM
tid=af9d78f239282da81bbd28d54f333a83

 【请求的 ip 】：64.236.153.104
 【 用  户 】 加了  133         个单词上限2025-11-21 15:42:17
######## 11/21/2025, 3:42:28 PM
tid=af9d78f239282da81bbd28d54f333a83

 【请求的 ip 】：20.81.158.145
 【 用  户 】 加了  133         个单词上限2025-11-21 17:44:05
######## 11/21/2025, 5:44:16 PM
tid=af9d78f239282da81bbd28d54f333a83

 【请求的 ip 】：172.183.134.177
 【 用  户 】 加了  133         个单词上限2025-11-21 18:46:22
######## 11/21/2025, 6:46:33 PM
tid=af9d78f239282da81bbd28d54f333a83

 【请求的 ip 】：172.214.44.51
 【 用  户 】 加了  133         个单词上限2025-11-22 12:44:37
######## 11/22/2025, 12:44:48 PM
tid=af9d78f239282da81bbd28d54f333a83

 【请求的 ip 】：68.220.57.100
 【 用  户 】 加了  136         个单词上限2025-11-22 14:48:56
######## 11/22/2025, 2:49:06 PM
tid=af9d78f239282da81bbd28d54f333a83

 【请求的 ip 】：4.246.134.180
 【 用  户 】 加了  136         个单词上限2025-11-22 15:40:00
######## 11/22/2025, 3:40:11 PM
tid=af9d78f239282da81bbd28d54f333a83

 【请求的 ip 】：64.236.133.177
 【 用  户 】 加了  136         个单词上限2025-11-22 17:41:21
######## 11/22/2025, 5:41:32 PM
tid=af9d78f239282da81bbd28d54f333a83

 【请求的 ip 】：52.161.45.227
 【 用  户 】 加了  136         个单词上限2025-11-22 18:42:19
######## 11/22/2025, 6:42:30 PM
tid=af9d78f239282da81bbd28d54f333a83

 【请求的 ip 】：20.109.95.99
 【 用  户 】 加了  136         个单词上限2025-11-23 12:53:10
######## 11/23/2025, 12:53:21 PM
tid=0c3257bdc0cac6ddc70fd47873173670

 【请求的 ip 】：172.182.193.136
 【 用  户 】 加了  136         个单词上限2025-11-23 14:50:43
######## 11/23/2025, 2:50:54 PM
tid=0c3257bdc0cac6ddc70fd47873173670

 【请求的 ip 】：135.237.130.146
 【 用  户 】 加了  136         个单词上限2025-11-23 15:40:52
######## 11/23/2025, 3:41:02 PM
tid=0c3257bdc0cac6ddc70fd47873173670

 【请求的 ip 】：20.236.100.0
 【 用  户 】 加了  136         个单词上限2025-11-23 17:41:49
######## 11/23/2025, 5:42:00 PM
tid=0c3257bdc0cac6ddc70fd47873173670

 【请求的 ip 】：57.151.137.213
 【 用  户 】 加了  136         个单词上限2025-11-23 18:43:07
######## 11/23/2025, 6:43:18 PM
tid=0c3257bdc0cac6ddc70fd47873173670

 【请求的 ip 】：57.151.128.129
 【 用  户 】 加了  136         个单词上限2025-11-24 12:55:04
######## 11/24/2025, 12:55:15 PM
tid=0c3257bdc0cac6ddc70fd47873173670

 【请求的 ip 】：4.236.151.7
 【 用  户 】 加了  136         个单词上限2025-11-24 14:53:34
######## 11/24/2025, 2:53:44 PM
tid=0c3257bdc0cac6ddc70fd47873173670

 【请求的 ip 】：52.150.29.102
 【 用  户 】 加了  136         个单词上限2025-11-24 15:42:18
######## 11/24/2025, 3:42:29 PM
tid=0c3257bdc0cac6ddc70fd47873173670

 【请求的 ip 】：135.232.208.113
 【 用  户 】 加了  136         个单词上限2025-11-24 17:47:44
######## 11/24/2025, 5:47:55 PM
tid=0c3257bdc0cac6ddc70fd47873173670

 【请求的 ip 】：52.225.25.97
 【 用  户 】 加了  136         个单词上限2025-11-24 18:49:08
######## 11/24/2025, 6:49:19 PM
tid=0c3257bdc0cac6ddc70fd47873173670

 【请求的 ip 】：52.234.43.177
 【 用  户 】 加了  136         个单词上限2025-11-25 12:48:24
######## 11/25/2025, 12:48:35 PM
tid=cfec05dccecfc39ced60881ab9215994

 【请求的 ip 】：64.236.200.225
 【 用  户 】 加了  139         个单词上限2025-11-25 14:55:14
######## 11/25/2025, 2:55:25 PM
tid=cfec05dccecfc39ced60881ab9215994

 【请求的 ip 】：48.211.210.115
 【 用  户 】 加了  139         个单词上限2025-11-25 15:42:20
######## 11/25/2025, 3:42:31 PM
tid=be4503cc442aab3d56b9d82926e21b3d

 【请求的 ip 】：145.132.101.202
 【 用  户 】 加了  141         个单词上限2025-11-25 17:47:10
######## 11/25/2025, 5:47:21 PM
tid=be4503cc442aab3d56b9d82926e21b3d

 【请求的 ip 】：172.183.157.178
 【 用  户 】 加了  141         个单词上限2025-11-25 18:50:11
######## 11/25/2025, 6:50:22 PM
tid=be4503cc442aab3d56b9d82926e21b3d

 【请求的 ip 】：172.182.202.197
 【 用  户 】 加了  141         个单词上限2025-11-26 12:48:41
######## 11/26/2025, 12:48:53 PM
tid=be4503cc442aab3d56b9d82926e21b3d

 【请求的 ip 】：52.159.247.160
 【 用  户 】 加了  141         个单词上限2025-11-26 14:54:10
######## 11/26/2025, 2:54:21 PM
tid=be4503cc442aab3d56b9d82926e21b3d

 【请求的 ip 】：52.161.45.224
 【 用  户 】 加了  141         个单词上限2025-11-26 15:42:41
######## 11/26/2025, 3:42:52 PM
tid=be4503cc442aab3d56b9d82926e21b3d

 【请求的 ip 】：172.208.154.3
 【 用  户 】 加了  141         个单词上限2025-11-26 17:46:43
######## 11/26/2025, 5:46:53 PM
tid=c92f60095780d682ca612d4b7490fbc0

 【请求的 ip 】：20.161.69.38
 【 用  户 】 加了  144         个单词上限2025-11-26 18:49:06
######## 11/26/2025, 6:49:16 PM
tid=c92f60095780d682ca612d4b7490fbc0

 【请求的 ip 】：64.236.201.17
 【 用  户 】 加了  144         个单词上限2025-11-27 12:48:01
######## 11/27/2025, 12:48:12 PM
tid=c92f60095780d682ca612d4b7490fbc0

 【请求的 ip 】：172.214.47.50
 【 用  户 】 加了  144         个单词上限2025-11-27 14:54:47
######## 11/27/2025, 2:54:58 PM
tid=c92f60095780d682ca612d4b7490fbc0

 【请求的 ip 】：64.236.133.194
 【 用  户 】 加了  144         个单词上限2025-11-27 15:42:55
######## 11/27/2025, 3:43:06 PM
tid=c92f60095780d682ca612d4b7490fbc0

 【请求的 ip 】：52.159.245.166
 【 用  户 】 加了  144         个单词上限2025-11-27 17:45:16
######## 11/27/2025, 5:45:27 PM
tid=d3b2ca12776d43677207d151d7939d74

 【请求的 ip 】：57.151.137.176
 【 用  户 】 加了  147         个单词上限2025-11-27 18:47:56
######## 11/27/2025, 6:48:06 PM
tid=d3b2ca12776d43677207d151d7939d74

 【请求的 ip 】：52.154.130.209
 【 用  户 】 加了  147         个单词上限2025-11-28 12:47:26
######## 11/28/2025, 12:47:37 PM
tid=d3b2ca12776d43677207d151d7939d74

 【请求的 ip 】：40.116.92.114
 【 用  户 】 加了  147         个单词上限2025-11-28 14:54:17
######## 11/28/2025, 2:54:27 PM
tid=d3b2ca12776d43677207d151d7939d74

 【请求的 ip 】：20.169.50.38
 【 用  户 】 加了  147         个单词上限2025-11-28 15:42:24
######## 11/28/2025, 3:42:35 PM
tid=d3b2ca12776d43677207d151d7939d74

 【请求的 ip 】：64.236.140.210
 【 用  户 】 加了  147         个单词上限2025-11-28 17:43:56
######## 11/28/2025, 5:44:07 PM
tid=d3b2ca12776d43677207d151d7939d74

 【请求的 ip 】：52.234.43.181
 【 用  户 】 加了  147         个单词上限2025-11-28 18:46:56
######## 11/28/2025, 6:47:07 PM
tid=d3b2ca12776d43677207d151d7939d74

 【请求的 ip 】：20.161.30.224
 【 用  户 】 加了  147         个单词上限2025-11-29 12:46:56
######## 11/29/2025, 12:47:07 PM
tid=7b30e7fd7893dd252e4529c6d0dd57f1

 【请求的 ip 】：20.169.75.67
 【 用  户 】 加了  150         个单词上限2025-11-29 14:51:46
######## 11/29/2025, 2:51:56 PM
tid=e6769bf3313a8ef747d15134e03dd321

 【请求的 ip 】：48.214.53.179
 【 用  户 】 加了  151         个单词上限2025-11-29 15:41:08
######## 11/29/2025, 3:41:19 PM
tid=e6769bf3313a8ef747d15134e03dd321

 【请求的 ip 】：52.173.163.130
 【 用  户 】 加了  151         个单词上限2025-11-29 17:42:06
######## 11/29/2025, 5:42:16 PM
tid=e6769bf3313a8ef747d15134e03dd321

 【请求的 ip 】：52.165.213.176
 【 用  户 】 加了  151         个单词上限2025-11-29 18:43:52
######## 11/29/2025, 6:44:03 PM
tid=e6769bf3313a8ef747d15134e03dd321

 【请求的 ip 】：64.236.201.33
 【 用  户 】 加了  151         个单词上限2025-11-30 12:54:34
######## 11/30/2025, 12:54:45 PM
